author,title,pages,year,link_open_access,link_publisher,proceedings_uri,paper_uri,label_proceedings,subtitle_proceedings,abstract,category,keywords,cnt_keyword,topics,cnt_topic,list_author,cnt_author,list_url,cnt_url
Mike Personick,Bigdata: Enabling the Semantic Web at Web-Scale,,2009,http://data.semanticweb.org/pdfs/iswc/2009/industry/iswc_industry_01.pdf,,http://data.semanticweb.org/conference/iswc/2009/industry-proceedings,http://data.semanticweb.org/conference/iswc/2009/industry-proceedings/paper-01,Proceedings of ISWC 2009 Industry Track,,,Industrial Track Paper,,0,,0,Mike Personick,1,http://data.semanticweb.org/pdfs/iswc/2009/industry/iswc_industry_01.pdf,1
Mike Lang Jr and Greg Milbank,"Descriptions, Ontologies, Collaboration and Governance",,2009,http://data.semanticweb.org/pdfs/iswc/2009/industry/iswc_industry_04.pdf,,http://data.semanticweb.org/conference/iswc/2009/industry-proceedings,http://data.semanticweb.org/conference/iswc/2009/industry-proceedings/paper-02,Proceedings of ISWC 2009 Industry Track,,,Industrial Track Paper,,0,,0,Greg Milbank;Mike Lang Jr,2,http://data.semanticweb.org/pdfs/iswc/2009/industry/iswc_industry_04.pdf,1
Evan Sandhaus,Linked Data And The New York Times,,2009,http://data.nytimes.com/ppt/iswc_public.ppt,,http://data.semanticweb.org/conference/iswc/2009/industry-proceedings,http://data.semanticweb.org/conference/iswc/2009/industry-proceedings/paper-03,Proceedings of ISWC 2009 Industry Track,,,Industrial Track Paper,,0,,0,Evan Sandhaus,1,http://data.nytimes.com/ppt/iswc_public.ppt,1
Craig Norvell,"Moving Objects: Look in the Past, Manage the Present and Predict the Future",,2009,http://data.semanticweb.org/pdfs/iswc/2009/industry/iswc_industry_02.pdf,,http://data.semanticweb.org/conference/iswc/2009/industry-proceedings,http://data.semanticweb.org/conference/iswc/2009/industry-proceedings/paper-04,Proceedings of ISWC 2009 Industry Track,,,Industrial Track Paper,,0,,0,Craig Norvell,1,http://data.semanticweb.org/pdfs/iswc/2009/industry/iswc_industry_02.pdf,1
Cory Casanave,Open Architectures for Open Government,,2009,http://lib.modeldriven.org/MDLibrary/trunk/Pub/Presentations/ISWC_OpenGovernmentArchitectures.ppt,,http://data.semanticweb.org/conference/iswc/2009/industry-proceedings,http://data.semanticweb.org/conference/iswc/2009/industry-proceedings/paper-05,Proceedings of ISWC 2009 Industry Track,,,Industrial Track Paper,,0,,0,Cory Casanave,1,http://lib.modeldriven.org/MDLibrary/trunk/Pub/Presentations/ISWC_OpenGovernmentArchitectures.ppt,1
John Hebeler and Andrew Perez-Lopez,Strengthen your SOA with Semantics,,2009,http://semwebprogramming.org/conferences/ISWC2009/StrengtheningSOAwithSemanticsISWC2009.pdf,,http://data.semanticweb.org/conference/iswc/2009/industry-proceedings,http://data.semanticweb.org/conference/iswc/2009/industry-proceedings/paper-06,Proceedings of ISWC 2009 Industry Track,,,Industrial Track Paper,,0,,0,Andrew Perez-Lopez;John Hebeler,2,http://semwebprogramming.org/conferences/ISWC2009/StrengtheningSOAwithSemanticsISWC2009.pdf,1
Gary Sikora,Systems Ontological Use-Cases,,2009,http://data.semanticweb.org/pdfs/iswc/2009/industry/iswc_industry_03.pdf,,http://data.semanticweb.org/conference/iswc/2009/industry-proceedings,http://data.semanticweb.org/conference/iswc/2009/industry-proceedings/paper-07,Proceedings of ISWC 2009 Industry Track,,,Industrial Track Paper,,0,,0,Gary Sikora,1,http://data.semanticweb.org/pdfs/iswc/2009/industry/iswc_industry_03.pdf,1
Heiko Paulheim and Florian Probst,A Framework for Ontologies-based User Interface Integration,,2009,https://github.com/lidingpku/iswc-archive/raw/master/paper/iswc-2009-poster/101/paper101.pdf,,http://data.semanticweb.org/conference/iswc/2009/poster-demo-proceedings,http://data.semanticweb.org/conference/iswc/2009/poster-demo-proceedings/paper-01,Proceedings of ISWC 2009 Poster and Demo,,,Poster/Demo Paper,,0,,0,Heiko Paulheim;Florian Probst,2,https://github.com/lidingpku/iswc-archive/raw/master/paper/iswc-2009-poster/101/paper101.pdf,1
"Ian Oliver,John Howse,Gem Stapleton,Esko Nuutila and Seppo Torma",A Proposed Diagrammatic Logic for Ontology Specification and Visualization,,2009,https://github.com/lidingpku/iswc-archive/raw/master/paper/iswc-2009-poster/137/paper137.pdf,,http://data.semanticweb.org/conference/iswc/2009/poster-demo-proceedings,http://data.semanticweb.org/conference/iswc/2009/poster-demo-proceedings/paper-04,Proceedings of ISWC 2009 Poster and Demo,,"We propose a diagrammatic logic that is suitable for specifying ontologies. We provide a specification of a simple ontology and include examples to show how to place constraints on ontology specifications and define queries. The framework also allows the depiction of instances, multiple ontologies to be related, and reasoning about ontologies.",Poster/Demo Paper,,0,,0,John Howse;Esko Nuutila;Ian Oliver;Gem Stapleton;Seppo Torma,5,https://github.com/lidingpku/iswc-archive/raw/master/paper/iswc-2009-poster/137/paper137.pdf,1
"Cui Tao,Jyotishman Pathak,Harold R. Solbrig,Wei-Qi Wei and Christopher G. Chute",A RDF-base Normalized Model for Biomedical Lexical Grid,,2009,https://github.com/lidingpku/iswc-archive/raw/master/paper/iswc-2009-poster/174/paper174.pdf,,http://data.semanticweb.org/conference/iswc/2009/poster-demo-proceedings,http://data.semanticweb.org/conference/iswc/2009/poster-demo-proceedings/paper-05,Proceedings of ISWC 2009 Poster and Demo,,"The Lexical Grid (LexGrid) project is an on-going community-driven initiative coordinated by the Mayo Clinic Division of Biomedical Statistics and Informatics. It provides a common terminology model to represent multiple vocabulary and ontology sources as well as a scalable and robust API for accessing such information. While successfully used and adopted in the biomedical and clinical community, LexGrid model now needs to be aligned with emerging Semantic Web standards and specifications. This paper introduces the LexRDF model, which maps the LexGrid model elements to corresponding constructs in W3C speci¯cations such as RDF, OWL, and SKOS. With LexRDF, the terminological information represent in LexGrid can be translated to RDF triples, and therefore allowing LexGrid to leverage standard tools and technologies such as SPARQL and RDF triple stores.",Poster/Demo Paper,,0,,0,Wei-Qi Wei;Jyotishman Pathak;Harold R. Solbrig;Cui Tao;Christopher G. Chute,5,https://github.com/lidingpku/iswc-archive/raw/master/paper/iswc-2009-poster/174/paper174.pdf,1
"Rob Vesse,Wendy Hall and Les Carr",All About That - A URI Profiling Tool for monitoring and preserving Linked Data,,2009,https://github.com/lidingpku/iswc-archive/raw/master/paper/iswc-2009-poster/113/paper113.pdf,,http://data.semanticweb.org/conference/iswc/2009/poster-demo-proceedings,http://data.semanticweb.org/conference/iswc/2009/poster-demo-proceedings/paper-02,Proceedings of ISWC 2009 Poster and Demo,,All About That (AAT) is a URI Profiling tool which allows users to monitor and preserve Linked Data in which they are interested. Its design is based upon the principle of adapting ideas from hypermedia link integrity in order to apply them to the Semantic Web. As the Linked Data Web expands it will become increasingly important to maintain links such that the data remains useful and therefore this tool is presented as a step towards providing this maintenance capability.,Poster/Demo Paper,,0,,0,Rob Vesse;Les Carr;Wendy Hall,3,https://github.com/lidingpku/iswc-archive/raw/master/paper/iswc-2009-poster/113/paper113.pdf,1
Akshay Bhat,Analogy Engines for the Semantic Web,,2009,https://github.com/lidingpku/iswc-archive/raw/master/paper/iswc-2009-poster/130/paper130.pdf,,http://data.semanticweb.org/conference/iswc/2009/poster-demo-proceedings,http://data.semanticweb.org/conference/iswc/2009/poster-demo-proceedings/paper-03,Proceedings of ISWC 2009 Poster and Demo,,"We propose a new utility for Semantic Web called as Analogy Engine. Analogy engine employs an example based search approach for retrieving the most similar URIs for the given URI by comparing number of shared links. The Analogy engine is based on Analogy Space, which uses Singular Value Decomposition on matrix representation of a Semantic Network. However Analogy Space faces difficulty with networks having more than a few thousand nodes. We present our preliminary work on scaling Analogy Space by dividing the network into multiple communities, and creating separate Analogy Space for each community. We show that this procedure results in significant improvements and can be used for a large scale network such as the Semantic Web.",Poster/Demo Paper,,0,,0,Akshay Bhat,1,https://github.com/lidingpku/iswc-archive/raw/master/paper/iswc-2009-poster/130/paper130.pdf,1
Bernhard Schandl and Stefan Zander,Autonomous RDF Replication on Mobile Devices,,2009,https://github.com/lidingpku/iswc-archive/raw/master/paper/iswc-2009-poster/144/paper144.pdf,,http://data.semanticweb.org/conference/iswc/2009/poster-demo-proceedings,http://data.semanticweb.org/conference/iswc/2009/poster-demo-proceedings/paper-06,Proceedings of ISWC 2009 Poster and Demo,,"Mobile applications are of increasing interest for research and industry. The widespread use and improved capabilities of portable devices enable the deployment of sophisticated and powerful applications that provide the user with services at any time and location. When such applications are built on top of Linked Data, permanent network connectivity is required, which is often not available or expensive to establish. Hence we propose a framework that uses RDF-based context descriptions to selectively and proactively replicate data to mobile devices. These replicas can be used when no network connection can be established, thus making mobile applications and users more autonomous and stable.",Poster/Demo Paper,,0,,0,Stefan Zander;Bernhard Schandl,2,https://github.com/lidingpku/iswc-archive/raw/master/paper/iswc-2009-poster/144/paper144.pdf,1
"Klaas Dellschaft,Qiu Ji and Guilin Qi",CoDR: A Contextual Framework for Diagnosis and Repair,,2009,https://github.com/lidingpku/iswc-archive/raw/master/paper/iswc-2009-poster/125/paper125.pdf,,http://data.semanticweb.org/conference/iswc/2009/poster-demo-proceedings,http://data.semanticweb.org/conference/iswc/2009/poster-demo-proceedings/paper-07,Proceedings of ISWC 2009 Poster and Demo,,"Ontologies play a central role for the formal representation of knowledge on the Semantic Web. A major challenge in collaborative ontology construction is to handle inconsistencies caused by changes to the ontology. In this paper, we present our CoDR system which helps to diagnose and repair collaboratively constructed ontologies. CoDR integrates RaDON, an ontology diagnosis and repair tool, and Cicero, which provides discussion functionality for the ontology developers. CoDR is realized as a plugin for the NeOn Toolkit. It helps to use discussions held in Cicero as context information during repairing an ontology with RaDON. But it is also possible to use the diagnoses from RaDON during the discussions in Cicero.",Poster/Demo Paper,,0,,0,Klaas Dellschaft;Qiu Ji;Guilin Qi,3,https://github.com/lidingpku/iswc-archive/raw/master/paper/iswc-2009-poster/125/paper125.pdf,1
Christian Battista and Benjamin Coe,Collaborative climate change research on the semantic web,,2009,https://github.com/lidingpku/iswc-archive/raw/master/paper/iswc-2009-poster/133/paper133.pdf,,http://data.semanticweb.org/conference/iswc/2009/poster-demo-proceedings,http://data.semanticweb.org/conference/iswc/2009/poster-demo-proceedings/paper-08,Proceedings of ISWC 2009 Poster and Demo,,"WikiEarth (http://www.wikiearth.net) is a website designed for encouraging collaboration between researchers across the academic spectrum, and also serves as a test case to determine the limitations and benefits of using an ontological data structure to manage the input of natural science based data from around the world. Drawing upon Wikipedia's model of massive user collaboration, WikiEarth's motivation is to extend beyond this by formalizing the relationships between the data being entered. A semantic ontology is a natural candidate for data representation for three reasons: first, the hierarchical class structure of an OWL-Ontology helps avoid redundancy when developing simulations, as an operation can be applied to a class and all its subclasses; secondly, a framework like Jena helps eliminate human error and reduce the amount of data entry that needs to be performed; and finally, important restrictions regarding data entry are imposed by the ontological structure and Jena, as opposed to by a proprietary system developed for one specific application. Utilizing this infrastructure, a WikiEarth Climate Demonstration was successfully conceptualized, constructed, deployed and subsequently unveiled at the 2009 World Student Environmental Summit. The success of this application demonstrates that ontologies could be effectively purposed for a high-traffic production system.",Poster/Demo Paper,,0,,0,Christian Battista;Benjamin Coe,2,https://github.com/lidingpku/iswc-archive/raw/master/paper/iswc-2009-poster/133/paper133.pdf,1
Freddy Lecue,Composition Optimizer: A Tool for Optimizing Quality of Semantic Web Service Composition,,2009,https://github.com/lidingpku/iswc-archive/raw/master/paper/iswc-2009-poster/151/paper151.pdf,,http://data.semanticweb.org/conference/iswc/2009/poster-demo-proceedings,http://data.semanticweb.org/conference/iswc/2009/poster-demo-proceedings/paper-09,Proceedings of ISWC 2009 Poster and Demo,,"Ranking and optimization of web service compositions are some of the most interesting challenges at present. Since web services can be enhanced with formal semantic descriptions, forming the ""semantic web services"", it becomes conceivable to exploit the quality of semantic links between services (of any composition) as one of the optimization criteria. For this we propose to use the semantic similarities between output and input parameters of web services. Coupling this with other criteria such as quality of service (QoS) allow us to rank and optimize compositions achieving the same goal. We present the Composition Optimizer tool, using an innovative and extensible optimization model designed to balance semantic fit (or functional quality) with non-functional QoS metrics, in order to optimize service composition. To allow the use of this model in the context of a large number of services as foreseen by the EC-funded project SOA4All we propose and test the use of Genetic Algorithms.",Poster/Demo Paper,,0,,0,Freddy Lécué,1,https://github.com/lidingpku/iswc-archive/raw/master/paper/iswc-2009-poster/151/paper151.pdf,1
"Carolina Fortuna,Bogdan Ivan,Zoltan Padrah,Luka Bradesko,Blaz Fortuna and Mihael Mohorcic",Demonstration: Wireless Access Network Selection Enabled by Semantic Technologies,,2009,https://github.com/lidingpku/iswc-archive/raw/master/paper/iswc-2009-poster/187/paper187.pdf,,http://data.semanticweb.org/conference/iswc/2009/poster-demo-proceedings,http://data.semanticweb.org/conference/iswc/2009/poster-demo-proceedings/paper-10,Proceedings of ISWC 2009 Poster and Demo,,"Service oriented access in a multi-application, multi-access network environment is faced with the problem of cross-layer interoperability among technologies. In this demo, we present a knowledge base (KB) which contains local (user terminal specific) knowledge that enables pro-active network selection by translating technology specific parameters to higher-level, more abstract parameters. We implemented a prototype which makes use of semantic technology (namely ResearchCyc) for creating the elements of the KB and uses reasoning to determine the best access network. The system implements technology-specific parameter mapping according to the IEEE 802.21 draft standard recommendation.",Poster/Demo Paper,,0,,0,Bogdan Ivan;Blaz Fortuna;Mihael Mohorcic;Carolina Fortuna;Luka Bradesko;Zoltan Padrah,6,https://github.com/lidingpku/iswc-archive/raw/master/paper/iswc-2009-poster/187/paper187.pdf,1
"Lushan Han,Timothy Finin and Yelena Yesha",Finding Semantic Web Ontology Terms from Words,,2009,https://github.com/lidingpku/iswc-archive/raw/master/paper/iswc-2009-poster/162/paper162.pdf,,http://data.semanticweb.org/conference/iswc/2009/poster-demo-proceedings,http://data.semanticweb.org/conference/iswc/2009/poster-demo-proceedings/paper-11,Proceedings of ISWC 2009 Poster and Demo,,"The Semantic Web was designed to unambiguously define and use ontologies to encode data and knowledge on the Web. Many people find it difficult, however, to write complex RDF statements and queries because it requires familiarity with the appropriate ontologies and the terms they define. We describe a framework that eases the experiences in authoring and querying RDF data, in which we focus on automatically finding a set of appropriate Semantic Web ontology terms from a set of words used as the labels of nodes and edges in an incoming semantic graph.",Poster/Demo Paper,,0,,0,Timothy Finin;Lushan Han;Yelena Yesha,3,https://github.com/lidingpku/iswc-archive/raw/master/paper/iswc-2009-poster/162/paper162.pdf,1
"Divya S,Alpesh Gajbe,Rajiv Nair,Ganesh Gajre and Nagarjuna G",GNOWSYS-mode in Emacs for collaborative construction of knowledge networks in plain text,,2009,https://github.com/lidingpku/iswc-archive/raw/master/paper/iswc-2009-poster/191/paper191.pdf,,http://data.semanticweb.org/conference/iswc/2009/poster-demo-proceedings,http://data.semanticweb.org/conference/iswc/2009/poster-demo-proceedings/paper-12,Proceedings of ISWC 2009 Poster and Demo,,"GNOWSYS-mode is an Emacs extension package for knowledge networking and ontology management using GNOWSYS (Gnowledge Networking and Organizing SYStem) as a server. The demonstration shows how to collaboratively build ontologies and semantic network in an intuitive plain text without any of the RDF notations, though importing and exporting in RDF is possible.",Poster/Demo Paper,,0,,0,Rajiv Nair;Alpesh Gajbe;Nagarjuna G;Ganesh Gajre;Divya S,5,https://github.com/lidingpku/iswc-archive/raw/master/paper/iswc-2009-poster/191/paper191.pdf,1
"Martin Hepp,Andreas Radinger,Andreas Wechselberger,Alex Stolz,Daniel Bingel,Thomas Irmscher,Mark Mattern and Tobias Ostheim",GoodRelations Tools and Applications,,2009,https://github.com/lidingpku/iswc-archive/raw/master/paper/iswc-2009-poster/192/paper192.pdf,,http://data.semanticweb.org/conference/iswc/2009/poster-demo-proceedings,http://data.semanticweb.org/conference/iswc/2009/poster-demo-proceedings/paper-14,Proceedings of ISWC 2009 Poster and Demo,,"The adoption of ontologies for the Web of Data can be increased by tools that help populating respective knowledge bases from legacy content, e.g. existing databases, business applications, or proprietary data formats. In this demo and poster, we show the results from our efforts of developing a suite of open-source tools for creating e-commerce descriptions for the Web of Data based on the GoodRelations ontology. Also, we demonstrate how RDF/XML data can be (1) submitted to Yahoo SearchMonkey via the RDF2DataRSS conversion tool, (2) inspected using the SearchMonkey Meta-Data Inspector, and (3) how common data inconsistencies can be spotted with the GoodRelations Validator.",Poster/Demo Paper,,0,,0,Tobias Ostheim;Andreas Radinger;Andreas Wechselberger;Daniel Bingel;Alex Stolz;Thomas Irmscher;Mark Mattern;Martin Hepp,8,https://github.com/lidingpku/iswc-archive/raw/master/paper/iswc-2009-poster/192/paper192.pdf,1
"Delia Rusu,Blaz Fortuna and Dunja Mladenic",Improved Semantic Graphs with Word Sense Disambiguation,,2009,https://github.com/lidingpku/iswc-archive/raw/master/paper/iswc-2009-poster/184/paper184.pdf,,http://data.semanticweb.org/conference/iswc/2009/poster-demo-proceedings,http://data.semanticweb.org/conference/iswc/2009/poster-demo-proceedings/paper-15,Proceedings of ISWC 2009 Poster and Demo,,"Semantic graphs can be seen as a way of representing and visualizing textual information in more structured, RDF-like graphs. The reader thus obtains an overview of the content, without having to read through the text. In building a compact semantic graph, an important step is grouping similar concepts under the same label and connecting them to external repositories. This is achieved through disambiguating word senses, in our case by assigning the sense to a concept given its context. The paper presents an unsupervised, knowledge based word sense disambiguating algorithm for linking semantic graph nodes to the WordNet vocabulary. The algorithm is integrated in the semantic graph generation pipeline, improving the semantic graph readability and conciseness. Experimental evaluation of the proposed disambiguation algorithm shows that it gives good results.",Poster/Demo Paper,,0,,0,Dunja Mladenic;Blaz Fortuna;Delia Rusu,3,https://github.com/lidingpku/iswc-archive/raw/master/paper/iswc-2009-poster/184/paper184.pdf,1
"Isabel Cruz,Flavio Palandri Antonelli and Cosmin Stroe",Integrated Ontology Matching and Evaluation,,2009,https://github.com/lidingpku/iswc-archive/raw/master/paper/iswc-2009-poster/120/paper120.pdf,,http://data.semanticweb.org/conference/iswc/2009/poster-demo-proceedings,http://data.semanticweb.org/conference/iswc/2009/poster-demo-proceedings/paper-16,Proceedings of ISWC 2009 Poster and Demo,,"The AgreementMaker system for ontology matching includes an extensible architecture, which facilitates the integration and performance tuning of a variety of matching methods, an evaluation mechanism, which can make use of a reference matching or rely solely on quality measures, and a multi-purpose user interface, which drives both the matching methods and the evaluation strategies. Our demo focuses on the tight integration of matching methods and evaluation strategies, a unique feature of our system.",Poster/Demo Paper,,0,,0,Cosmin Stroe;Isabel Cruz;Flavio Palandri Antonelli,3,https://github.com/lidingpku/iswc-archive/raw/master/paper/iswc-2009-poster/120/paper120.pdf,1
JIAO TAO and Evren Sirin,Integrity Constraints in OWL,,2009,https://github.com/lidingpku/iswc-archive/raw/master/paper/iswc-2009-poster/194/paper194.pdf,,http://data.semanticweb.org/conference/iswc/2009/poster-demo-proceedings,http://data.semanticweb.org/conference/iswc/2009/poster-demo-proceedings/paper-17,Proceedings of ISWC 2009 Poster and Demo,,"In many data-centric applications, it is desirable to use OWL as an expressive schema language with which one expresses constraints that must be satisfied by instance data. However, specific aspects of OWL's standard semantics---i.e., the Open World Assumption (OWA) and the absence of Unique Name Assumption (UNA)---make it difficult to use OWL in this way. In this paper, we present an Integrity Constraint (IC) semantics for OWL axioms, show that IC validation can be reduced to query answering, and present our preliminary results with a prototype implementation using Pellet.",Poster/Demo Paper,,0,,0,JIAO TAO;Evren Sirin,2,https://github.com/lidingpku/iswc-archive/raw/master/paper/iswc-2009-poster/194/paper194.pdf,1
"Maria Sokhn,Elena Mugellini,Omar Abou Khaled and Ahmed Serhrouchni",Knowledge based conference video-recordings visualization,,2009,https://github.com/lidingpku/iswc-archive/raw/master/paper/iswc-2009-poster/121/paper121.pdf,,http://data.semanticweb.org/conference/iswc/2009/poster-demo-proceedings,http://data.semanticweb.org/conference/iswc/2009/poster-demo-proceedings/paper-19,Proceedings of ISWC 2009 Poster and Demo,,The advent of technologies in information retrieval driven by users requests calls for an effort to conceive and develop semantic-based applications. In recent years the semantic web gave place for a new generation of search query engines that rely on the semantic of the documents expressed by metadata. In this paper we present a knowledge-based approach to visualizing and navigating through conference video-recordings. This approach is based on a conference ontology that models the information conveyed within a conference life cycle.,Poster/Demo Paper,,0,,0,Ahmed Serhrouchni;Elena Mugellini;Maria Sokhn;Omar Abou Khaled,4,https://github.com/lidingpku/iswc-archive/raw/master/paper/iswc-2009-poster/121/paper121.pdf,1
