event_uri,super_event_uri,order_in_super_event,event_type,label,start,end,duration,tzid,room,address,chair_label,chair_person,presenter_label,presenter_person,author,acronym,abstract,homepage,link_document,logo,category
http://data.semanticweb.org/conference/iswc/2003/track/industrial,http://data.semanticweb.org/conference/iswc/2003,,http://data.semanticweb.org/ns/swc/ontology#TrackEvent,Industrial Track,,,,,,,,,,,,,,,,,
http://data.semanticweb.org/conference/iswc/2003/track/main,http://data.semanticweb.org/conference/iswc/2003,,http://data.semanticweb.org/ns/swc/ontology#TrackEvent,Main Track,,,,,,,,,,,,,,,,,
http://data.semanticweb.org/conference/iswc/2003/track/tutorial,http://data.semanticweb.org/conference/iswc/2003,,http://data.semanticweb.org/ns/swc/ontology#TrackEvent,Tutorial Track,,,,,,,,,,,,,,,,,
http://data.semanticweb.org/conference/iswc/2003/session-1a/event-01,http://data.semanticweb.org/conference/iswc/2003/session-1a,1,http://data.semanticweb.org/ns/swc/ontology#TalkEvent,Semi-automatic Semantic Annotation of Images Using Machine Learning Techniques,,,,,,,,,,,Oge Marques and Nitish Barman,,,,,,Multi-media
http://data.semanticweb.org/conference/iswc/2003/session-1a/event-02,http://data.semanticweb.org/conference/iswc/2003/session-1a,2,http://data.semanticweb.org/ns/swc/ontology#TalkEvent,Integrating Structure and Semantics into Audio-visual Documents,,,,,,,,,,,Raphaël Troncy,,,,,,Multi-media
http://data.semanticweb.org/conference/iswc/2003/session-1a/event-03,http://data.semanticweb.org/conference/iswc/2003/session-1a,3,http://data.semanticweb.org/ns/swc/ontology#TalkEvent,SCULPTEUR: Towards a New Paradigm for Multimedia Museum Information Handling,,,,,,,,,,,"Matthew Addis,Mike J. Boniface,Simon Goodall,Paul Grimwood,Sanghee Kim,Paul H. Lewis,Kirk Martinez and Alison Stevenson",,,,,,Multi-media
http://data.semanticweb.org/conference/iswc/2003/session-1b/event-01,http://data.semanticweb.org/conference/iswc/2003/session-1b,1,http://data.semanticweb.org/ns/swc/ontology#TalkEvent,Semantic Coordination: A New Approach and an Application,,,,,,,,,,,"Paolo Bouquet,Luciano Serafini and Stefano Zanobini",,,,,,Ontological Reasoning
http://data.semanticweb.org/conference/iswc/2003/session-1b/event-02,http://data.semanticweb.org/conference/iswc/2003/session-1b,2,http://data.semanticweb.org/ns/swc/ontology#TalkEvent,Reducing OWL Entailment to Description Logic Satisfiability,,,,,,,,,,,Ian Horrocks and Peter F. Patel-Schneider,,,,,,Foundations
http://data.semanticweb.org/conference/iswc/2003/session-1b/event-03,http://data.semanticweb.org/conference/iswc/2003/session-1b,3,http://data.semanticweb.org/ns/swc/ontology#TalkEvent,RDFS(FA) and RDF MT: Two Semantics for RDFS,,,,,,,,,,,Jeff Z. Pan and Ian Horrocks,,,,,,Foundations
http://data.semanticweb.org/conference/iswc/2003/session-1c/event-01,http://data.semanticweb.org/conference/iswc/2003/session-1c,2,http://data.semanticweb.org/ns/swc/ontology#TalkEvent,ODESeW. Automatic Generation of Knowledge Portals for Intranets and Extranets,,,,,,,,,,,"Óscar Corcho,Asunción Gómez-Pérez,Angel López-Cima,V. López-García and María del Carmen Suárez-Figueroa",,,,,,Industrial Track Paper
http://data.semanticweb.org/conference/iswc/2003/session-1c/event-02,http://data.semanticweb.org/conference/iswc/2003/session-1c,3,http://data.semanticweb.org/ns/swc/ontology#TalkEvent,Making Business Sense of the Semantic Web,,,,,,,,,,,"Zavisa Bjelogrlic,Dirk-Willem van Gulik and Alberto Reggiori",,,,,,Industrial Track Paper
http://data.semanticweb.org/conference/iswc/2003/session-2a/event-01,http://data.semanticweb.org/conference/iswc/2003/session-2a,1,http://data.semanticweb.org/ns/swc/ontology#TalkEvent,Towards Ontology-Driven Discourse: From Semantic Graphs to Multimedia Presentations,,,,,,,,,,,"Joost Geurts,Stefano Bocconi,Jacco van Ossenbruggen and Lynda Hardman",,,,,,Multi-media
http://data.semanticweb.org/conference/iswc/2003/session-2a/event-02,http://data.semanticweb.org/conference/iswc/2003/session-2a,2,http://data.semanticweb.org/ns/swc/ontology#TalkEvent,FrameNet Meets the Semantic Web: Lexical Semantics for the Web,,,,,,,,,,,"Srini Narayanan,Collin F. Baker,Charles J. Fillmore and Miriam R. L. Petruck",,,,,,Applications
http://data.semanticweb.org/conference/iswc/2003/session-2a/event-03,http://data.semanticweb.org/conference/iswc/2003/session-2a,3,http://data.semanticweb.org/ns/swc/ontology#TalkEvent,A Q-Based Architecture for Semantic Information Interoperability on Semantic Web,,,,,,,,,,,"Zhen-jie Wang,Huanye Sheng and Peng Ding",,,,,,Applications
http://data.semanticweb.org/conference/iswc/2003/session-2b/event-01,http://data.semanticweb.org/conference/iswc/2003/session-2b,1,http://data.semanticweb.org/ns/swc/ontology#TalkEvent,Web Ontology Reasoning with Datatype Groups,,,,,,,,,,,Jeff Z. Pan and Ian Horrocks,,,,,,Foundations
http://data.semanticweb.org/conference/iswc/2003/session-2b/event-02,http://data.semanticweb.org/conference/iswc/2003/session-2b,2,http://data.semanticweb.org/ns/swc/ontology#TalkEvent,Merging Topics in Well-Formed XML Topic Maps,,,,,,,,,,,Richard Widhalm and Thomas A. Mück,,,,,,Foundations
http://data.semanticweb.org/conference/iswc/2003/session-2b/event-03,http://data.semanticweb.org/conference/iswc/2003/session-2b,3,http://data.semanticweb.org/ns/swc/ontology#TalkEvent,Semantic Processing of the Semantic Web,,,,,,,,,,,Kunal Patel and Gopal Gupta,,,,,,Foundations
http://data.semanticweb.org/conference/iswc/2003/session-2c/event-01,http://data.semanticweb.org/conference/iswc/2003/session-2c,1,http://data.semanticweb.org/ns/swc/ontology#TalkEvent,KIM - Semantic Annotation Platform,,,,,,,,,,,"Borislav Popov,Atanas Kiryakov,Angel Kirilov,Dimitar Manov,Damyan Ognyanoff and Miroslav Goranov",,,,,,Industrial Track Paper
http://data.semanticweb.org/conference/iswc/2003/session-2c/event-02,http://data.semanticweb.org/conference/iswc/2003/session-2c,2,http://data.semanticweb.org/ns/swc/ontology#TalkEvent,Ontology-Oriented Programming: Static Typing for the Inconsistent Programmer,,,,,,,,,,,Neil M. Goldman,,,,,,Industrial Track Paper
http://data.semanticweb.org/conference/iswc/2003/session-2c/event-03,http://data.semanticweb.org/conference/iswc/2003/session-2c,3,http://data.semanticweb.org/ns/swc/ontology#TalkEvent,A Semantic Infosphere,,,,,,,,,,,"Michael Uschold,Peter Clark,Fred Dickey,Casey K. Fung,Sonia Smith,Stephen A. Uczekaj,Michael Wilke,Sean Bechhofer and Ian Horrocks",,,,,,Industrial Track Paper
http://data.semanticweb.org/conference/iswc/2003/session-3a/event-01,http://data.semanticweb.org/conference/iswc/2003/session-3a,1,http://data.semanticweb.org/ns/swc/ontology#TalkEvent,"Semantic Annotation, Indexing, and Retrieval",,,,,,,,,,,"Atanas Kiryakov,Borislav Popov,Damyan Ognyanoff,Dimitar Manov,Angel Kirilov and Miroslav Goranov",,,,,,Information Retrieval
http://data.semanticweb.org/conference/iswc/2003/session-3a/event-02,http://data.semanticweb.org/conference/iswc/2003/session-3a,2,http://data.semanticweb.org/ns/swc/ontology#TalkEvent,An Approach for the Ranking of Query Results in the Semantic Web,,,,,,,,,,,"Nenad Stojanovic,Rudi Studer and Ljiljana Stojanovic",,,,,,Information Retrieval
http://data.semanticweb.org/conference/iswc/2003/session-3a/event-03,http://data.semanticweb.org/conference/iswc/2003/session-3a,3,http://data.semanticweb.org/ns/swc/ontology#TalkEvent,Querying Semantic Web Resources Using TRIPLE Views,,,,,,,,,,,"Zoltán Miklós,Gustaf Neumann,Uwe Zdun and Michael Sintek",,,,,,Information Retrieval
http://data.semanticweb.org/conference/iswc/2003/session-3a/event-04,http://data.semanticweb.org/conference/iswc/2003/session-3a,4,http://data.semanticweb.org/ns/swc/ontology#TalkEvent,Automatic Annotation of Content-Rich HTML Documents: Structural and Semantic Analysis,,,,,,,,,,,"Saikat Mukherjee,Guizhen Yang and I. V. Ramakrishnan",,,,,,Information Retrieval
http://data.semanticweb.org/conference/iswc/2003/session-3b/event-01,http://data.semanticweb.org/conference/iswc/2003/session-3b,1,http://data.semanticweb.org/ns/swc/ontology#TalkEvent,The DAML-S Virtual Machine,,,,,,,,,,,"Massimo Paolucci,Anupriya Ankolekar,Naveen Srinivasan and Katia P. Sycara",,,,,,Semantic Web Services
http://data.semanticweb.org/conference/iswc/2003/session-3b/event-02,http://data.semanticweb.org/conference/iswc/2003/session-3b,3,http://data.semanticweb.org/ns/swc/ontology#TalkEvent,A Policy Based Approach to Security for the Semantic Web,,,,,,,,,,,"Lalana Kagal,Timothy W. Finin and Anupam Joshi",,,,,,"Security, Trust, and Privacy"
http://data.semanticweb.org/conference/iswc/2003/session-3b/event-03,http://data.semanticweb.org/conference/iswc/2003/session-3b,4,http://data.semanticweb.org/ns/swc/ontology#TalkEvent,Prolog-Based Infrastructure for RDF: Scalability and Performance,,,,,,,,,,,"Jan Wielemaker,Guus Schreiber and Bob J. Wielinga",,,,,,Tools and Metodologies
http://data.semanticweb.org/conference/iswc/2003/session-3c/event-01,http://data.semanticweb.org/conference/iswc/2003/session-3c,1,http://data.semanticweb.org/ns/swc/ontology#TalkEvent,Task Computing - The Semantic Web Meets Pervasive Computing,,,,,,,,,,,"Ryusuke Masuoka,Bijan Parsia and Yannis Labrou",,,,,,Industrial Track Paper
http://data.semanticweb.org/conference/iswc/2003/session-3c/event-02,http://data.semanticweb.org/conference/iswc/2003/session-3c,2,http://data.semanticweb.org/ns/swc/ontology#TalkEvent,Ontology-Based Information Integration in the Automotive Industry,,,,,,,,,,,"Andreas Maier,Hans-Peter Schnurr and York Sure",,,,,,Industrial Track Paper
http://data.semanticweb.org/conference/iswc/2003/session-3c/event-03,http://data.semanticweb.org/conference/iswc/2003/session-3c,3,http://data.semanticweb.org/ns/swc/ontology#TalkEvent,Ontology-Based Query and Answering in Chemistry: OntoNova @ Project Halo,,,,,,,,,,,"Jürgen Angele,Eddie Mönch,Henrik Oppermann,Steffen Staab and Dirk Wenke",,,,,,Industrial Track Paper
http://data.semanticweb.org/conference/iswc/2003/session-3c/event-04,http://data.semanticweb.org/conference/iswc/2003/session-3c,4,http://data.semanticweb.org/ns/swc/ontology#TalkEvent,ScadaOnWeb - Web Based Supervisory Control and Data Acquisition,,,,,,,,,,,"Thomas Dreyer,David Leal,Andrea Schröder and Michael Schwan",,,,,,Industrial Track Paper
http://data.semanticweb.org/conference/iswc/2003/session-4a/event-01,http://data.semanticweb.org/conference/iswc/2003/session-4a,1,http://data.semanticweb.org/ns/swc/ontology#TalkEvent,C-OWL: Contextualizing Ontologies,,,,,,,,,,,"Paolo Bouquet,Fausto Giunchiglia,Frank van Harmelen,Luciano Serafini and Heiner Stuckenschmidt",,,,,,Ontological Reasoning
http://data.semanticweb.org/conference/iswc/2003/session-4a/event-02,http://data.semanticweb.org/conference/iswc/2003/session-4a,2,http://data.semanticweb.org/ns/swc/ontology#TalkEvent,Web Ontology Language Requirements w.r.t Expressiveness of Taxonomy and Axioms in Medicine,,,,,,,,,,,"Christine Golbreich,Olivier Dameron,Bernard Gibaud and Anita Burgun",,,,,,Ontological Reasoning
http://data.semanticweb.org/conference/iswc/2003/session-4a/event-03,http://data.semanticweb.org/conference/iswc/2003/session-4a,3,http://data.semanticweb.org/ns/swc/ontology#TalkEvent,Interoperability on XML Data,,,,,,,,,,,Laks V. S. Lakshmanan and Fereidoon Sadri,,,,,,Ontological Reasoning
http://data.semanticweb.org/conference/iswc/2003/session-4b/event-01,http://data.semanticweb.org/conference/iswc/2003/session-4b,1,http://data.semanticweb.org/ns/swc/ontology#TalkEvent,WebScripter: Grass-Roots Ontology Alignment via End-User Report Creation,,,,,,,,,,,"Baoshi Yan,Martin R. Frank,Pedro A. Szekely,Robert Neches and Juan Lopez",,,,,,Applications
http://data.semanticweb.org/conference/iswc/2003/session-4b/event-02,http://data.semanticweb.org/conference/iswc/2003/session-4b,2,http://data.semanticweb.org/ns/swc/ontology#TalkEvent,Magpie - Towards a Semantic Web Browser,,,,,,,,,,,"Martin Dzbor,John Domingue and Enrico Motta",,,,,,Applications
http://data.semanticweb.org/conference/iswc/2003/session-4b/event-03,http://data.semanticweb.org/conference/iswc/2003/session-4b,3,http://data.semanticweb.org/ns/swc/ontology#TalkEvent,Ontology-Based Resource Matching in the Grid - The Grid Meets the Semantic Web,,,,,,,,,,,"Hongsuda Tangmunarunkit,Stefan Decker and Carl Kesselman",,,,,,Applications
http://data.semanticweb.org/conference/iswc/2003/session-5a/event-01,http://data.semanticweb.org/conference/iswc/2003/session-5a,1,http://data.semanticweb.org/ns/swc/ontology#TalkEvent,Infrastructure for Web Explanations,,,,,,,,,,,Deborah L. McGuinness and Paulo Pinheiro da Silva,,,,,,Foundations
http://data.semanticweb.org/conference/iswc/2003/session-5a/event-02,http://data.semanticweb.org/conference/iswc/2003/session-5a,2,http://data.semanticweb.org/ns/swc/ontology#TalkEvent,"Representing the UMLS Semantic Network Using OWL: (Or ""What's in a Semantic Web Link?"")",,,,,,,,,,,Vipul Kashyap and Alexander Borgida,,,,,,Foundations
http://data.semanticweb.org/conference/iswc/2003/session-5a/event-03,http://data.semanticweb.org/conference/iswc/2003/session-5a,3,http://data.semanticweb.org/ns/swc/ontology#TalkEvent,Viewing the Semantic Web through RVL Lenses,,,,,,,,,,,"Aimilia Magkanaraki,Val Tannen,Vassilis Christophides and Dimitris Plexousakis",,,,,,Foundations
http://data.semanticweb.org/conference/iswc/2003/session-5b/event-01,http://data.semanticweb.org/conference/iswc/2003/session-5b,1,http://data.semanticweb.org/ns/swc/ontology#TalkEvent,Surfing the Service Web,,,,,,,,,,,"Sudhir Agarwal,Siegfried Handschuh and Steffen Staab",,,,,,Semantic Web Services
http://data.semanticweb.org/conference/iswc/2003/session-5b/event-02,http://data.semanticweb.org/conference/iswc/2003/session-5b,2,http://data.semanticweb.org/ns/swc/ontology#TalkEvent,Adapting BPEL4WS for the Semantic Web: The Bottom-Up Approach to Web Service Interoperation,,,,,,,,,,,Daniel J. Mandell and Sheila A. McIlraith,,,,,,Semantic Web Services
http://data.semanticweb.org/conference/iswc/2003/session-5b/event-03,http://data.semanticweb.org/conference/iswc/2003/session-5b,3,http://data.semanticweb.org/ns/swc/ontology#TalkEvent,Request Rewriting-Based Web Service Discovery,,,,,,,,,,,"Boualem Benatallah,Mohand-Said Hacid,Christophe Rey and Farouk Toumani",,,,,,Semantic Web Services
http://data.semanticweb.org/conference/iswc/2003/session-6a/event-01,http://data.semanticweb.org/conference/iswc/2003/session-6a,1,http://data.semanticweb.org/ns/swc/ontology#TalkEvent,An Environment for Distributed Ontology Development Based on Dependency Management,,,,,,,,,,,"Eiichi Sunagawa,Kouji Kozaki,Yoshinobu Kitamura and Riichiro Mizoguchi",,,,,,Agents and the Semantic Web
http://data.semanticweb.org/conference/iswc/2003/session-6a/event-02,http://data.semanticweb.org/conference/iswc/2003/session-6a,2,http://data.semanticweb.org/ns/swc/ontology#TalkEvent,Beyond Ontology Construction; Ontology Services as Online Knowledge Sharing Communities,,,,,,,,,,,"Yang Li,Simon G. Thompson,Zhu Tan,Nick Giles and Hamid Gharib",,,,,,Agents and the Semantic Web
http://data.semanticweb.org/conference/iswc/2003/session-6a/event-03,http://data.semanticweb.org/conference/iswc/2003/session-6a,3,http://data.semanticweb.org/ns/swc/ontology#TalkEvent,"Semantic Web Languages for Policy Representation and Reasoning: A Comparison of KAoS, Rei, and Ponder",,,,,,,,,,,"Gianluca Tonti,Jeffrey M. Bradshaw,Renia Jeffers,Rebecca Montanari,Niranjan Suri and Andrzej Uszok",,,,,,Agents and the Semantic Web
http://data.semanticweb.org/conference/iswc/2003/session-6a/event-04,http://data.semanticweb.org/conference/iswc/2003/session-6a,4,http://data.semanticweb.org/ns/swc/ontology#TalkEvent,An Agent Framework for Inter-personal Information Sharing with an RDF-Based Repository,,,,,,,,,,,"Koji Kamei,Sen Yoshida,Kazuhiro Kuwabara,Jun-ichi Akahani and Tetsuji Satoh",,,,,,Agents and the Semantic Web
http://data.semanticweb.org/conference/iswc/2003/session-6b/event-01,http://data.semanticweb.org/conference/iswc/2003/session-6b,1,http://data.semanticweb.org/ns/swc/ontology#TalkEvent,Learning to Attach Semantic Metadata to Web Services,,,,,,,,,,,Andreas Heß and Nicholas Kushmerick,,,,,,Semantic Web Services
http://data.semanticweb.org/conference/iswc/2003/session-6b/event-02,http://data.semanticweb.org/conference/iswc/2003/session-6b,2,http://data.semanticweb.org/ns/swc/ontology#TalkEvent,Automating DAML-S Web Services Composition Using SHOP2,,,,,,,,,,,"Dan Wu,Bijan Parsia,Evren Sirin,James A. Hendler and Dana S. Nau",,,,,,Semantic Web Services
http://data.semanticweb.org/conference/iswc/2003/session-6b/event-03,http://data.semanticweb.org/conference/iswc/2003/session-6b,3,http://data.semanticweb.org/ns/swc/ontology#TalkEvent,Semantic Markup for Semantic Web Tools: A DAML-S Description of an RDF-Store,,,,,,,,,,,Debbie Richards and Marta Sabou,,,,,,Semantic Web Services
http://data.semanticweb.org/conference/iswc/2003/session-6b/event-04,http://data.semanticweb.org/conference/iswc/2003/session-6b,4,http://data.semanticweb.org/ns/swc/ontology#TalkEvent,IRS-II: A Framework and Infrastructure for Semantic Web Services,,,,,,,,,,,"Enrico Motta,John Domingue,Liliana Cabral and Mauro Gaspari",,,,,,Semantic Web Services
http://data.semanticweb.org/conference/iswc/2003/session-7a/event-01,http://data.semanticweb.org/conference/iswc/2003/session-7a,1,http://data.semanticweb.org/ns/swc/ontology#TalkEvent,Towards a Knowledge-Based Approach to Semantic Service Composition,,,,,,,,,,,"Liming Chen,Nigel Shadbolt,Carole A. Goble,Feng Tao,Simon J. Cox,Colin Puleston and Paul R. Smart",,,,,,Semantic Web Services
http://data.semanticweb.org/conference/iswc/2003/session-7a/event-02,http://data.semanticweb.org/conference/iswc/2003/session-7a,2,http://data.semanticweb.org/ns/swc/ontology#TalkEvent,Security for DAML Web Services: Annotation and Matchmaking,,,,,,,,,,,"Grit Denker,Lalana Kagal,Timothy W. Finin,Massimo Paolucci and Katia P. Sycara",,,,,,"Security, Trust, and Privacy"
http://data.semanticweb.org/conference/iswc/2003/session-7a/event-03,http://data.semanticweb.org/conference/iswc/2003/session-7a,3,http://data.semanticweb.org/ns/swc/ontology#TalkEvent,Trust Management for the Semantic Web,,,,,,,,,,,"Matthew Richardson,Rakesh Agrawal and Pedro Domingos",,,,,,"Security, Trust, and Privacy"
http://data.semanticweb.org/conference/iswc/2003/session-7b/event-01,http://data.semanticweb.org/conference/iswc/2003/session-7b,1,http://data.semanticweb.org/ns/swc/ontology#TalkEvent,Haystack: A Platform for Authoring End User Semantic Web Applications,,,,,,,,,,,"Dennis Quan,David Huynh and David R. Karger",,,,,,Applications
http://data.semanticweb.org/conference/iswc/2003/session-7b/event-02,http://data.semanticweb.org/conference/iswc/2003/session-7b,2,http://data.semanticweb.org/ns/swc/ontology#TalkEvent,Mangrove: Enticing Ordinary People onto the Semantic Web via Instant Gratification,,,,,,,,,,,"Luke McDowell,Oren Etzioni,Steven D. Gribble,Alon Y. Halevy,Henry M. Levy,William Pentney,Deepak Verma and Stani Vlasseva",,,,,,Applications
http://data.semanticweb.org/conference/iswc/2003/session-7b/event-03,http://data.semanticweb.org/conference/iswc/2003/session-7b,3,http://data.semanticweb.org/ns/swc/ontology#TalkEvent,DAMLJessKB: A Tool for Reasoning with the Semantic Web,,,,,,,,,,,Joseph Kopena and William C. Regli,,,,,,Tools and Metodologies
http://data.semanticweb.org/conference/iswc/2003/session-8a/event-01,http://data.semanticweb.org/conference/iswc/2003/session-8a,1,http://data.semanticweb.org/ns/swc/ontology#TalkEvent,Signing RDF Graphs,,,,,,,,,,,Jeremy J. Carroll,,,,,,"Security, Trust, and Privacy"
http://data.semanticweb.org/conference/iswc/2003/session-8a/event-02,http://data.semanticweb.org/conference/iswc/2003/session-8a,2,http://data.semanticweb.org/ns/swc/ontology#TalkEvent,A Semantic E-Wallet to Reconcile Privacy and Context Awareness,,,,,,,,,,,Fabien Gandon and Norman M. Sadeh,,,,,,"Security, Trust, and Privacy"
http://data.semanticweb.org/conference/iswc/2003/session-8b/event-01,http://data.semanticweb.org/conference/iswc/2003/session-8b,1,http://data.semanticweb.org/ns/swc/ontology#TalkEvent,Benchmarking DAML+OIL Repositories,,,,,,,,,,,"Yuanbo Guo,Jeff Heflin and Zhengxiang Pan",,,,,,Tools and Metodologies
http://data.semanticweb.org/conference/iswc/2003/session-8b/event-02,http://data.semanticweb.org/conference/iswc/2003/session-8b,2,http://data.semanticweb.org/ns/swc/ontology#TalkEvent,Cooking the Semantic Web with the OWL API,,,,,,,,,,,"Sean Bechhofer,Raphael Volz and Phillip W. Lord",,,,,,Tools and Metodologies
http://data.semanticweb.org/conference/iswc/2003,http://data.semanticweb.org/conference/iswc,,http://data.semanticweb.org/ns/swc/ontology#ConferenceEvent,The Second International Semantic Web Conference,2003-10-20T08:00:00,2003-10-23T17:30:00,,America/New_York,,"Sanibel Island, Florida, USA",Tutorial Chair,Asunción Gómez-Pérez,,,,,,http://iswc2003.semanticweb.org/,,http://iswc2003.semanticweb.org/sunset2%20crop%20distort2.gif,
http://data.semanticweb.org/conference/iswc/2003,http://data.semanticweb.org/conference/iswc,,http://data.semanticweb.org/ns/swc/ontology#ConferenceEvent,The Second International Semantic Web Conference,2003-10-20T08:00:00,2003-10-23T17:30:00,,America/New_York,,"Sanibel Island, Florida, USA",Registration Chair,Atanas Kiryakov,,,,,,http://iswc2003.semanticweb.org/,,http://iswc2003.semanticweb.org/sunset2%20crop%20distort2.gif,
http://data.semanticweb.org/conference/iswc/2003,http://data.semanticweb.org/conference/iswc,,http://data.semanticweb.org/ns/swc/ontology#ConferenceEvent,The Second International Semantic Web Conference,2003-10-20T08:00:00,2003-10-23T17:30:00,,America/New_York,,"Sanibel Island, Florida, USA",Industrial Track Chair,Christoph Bussler,,,,,,http://iswc2003.semanticweb.org/,,http://iswc2003.semanticweb.org/sunset2%20crop%20distort2.gif,
http://data.semanticweb.org/conference/iswc/2003,http://data.semanticweb.org/conference/iswc,,http://data.semanticweb.org/ns/swc/ontology#ConferenceEvent,The Second International Semantic Web Conference,2003-10-20T08:00:00,2003-10-23T17:30:00,,America/New_York,,"Sanibel Island, Florida, USA",General Chair,Dieter Fensel,,,,,,http://iswc2003.semanticweb.org/,,http://iswc2003.semanticweb.org/sunset2%20crop%20distort2.gif,
http://data.semanticweb.org/conference/iswc/2003,http://data.semanticweb.org/conference/iswc,,http://data.semanticweb.org/ns/swc/ontology#ConferenceEvent,The Second International Semantic Web Conference,2003-10-20T08:00:00,2003-10-23T17:30:00,,America/New_York,,"Sanibel Island, Florida, USA",Local Arrangements Chair,Jeff Bradshaw,,,,,,http://iswc2003.semanticweb.org/,,http://iswc2003.semanticweb.org/sunset2%20crop%20distort2.gif,
http://data.semanticweb.org/conference/iswc/2003,http://data.semanticweb.org/conference/iswc,,http://data.semanticweb.org/ns/swc/ontology#ConferenceEvent,The Second International Semantic Web Conference,2003-10-20T08:00:00,2003-10-23T17:30:00,,America/New_York,,"Sanibel Island, Florida, USA",Demonstration Chair,Jeff Heflin,,,,,,http://iswc2003.semanticweb.org/,,http://iswc2003.semanticweb.org/sunset2%20crop%20distort2.gif,
http://data.semanticweb.org/conference/iswc/2003,http://data.semanticweb.org/conference/iswc,,http://data.semanticweb.org/ns/swc/ontology#ConferenceEvent,The Second International Semantic Web Conference,2003-10-20T08:00:00,2003-10-23T17:30:00,,America/New_York,,"Sanibel Island, Florida, USA",Finance Chair,Jérôme Euzenat,,,,,,http://iswc2003.semanticweb.org/,,http://iswc2003.semanticweb.org/sunset2%20crop%20distort2.gif,
http://data.semanticweb.org/conference/iswc/2003,http://data.semanticweb.org/conference/iswc,,http://data.semanticweb.org/ns/swc/ontology#ConferenceEvent,The Second International Semantic Web Conference,2003-10-20T08:00:00,2003-10-23T17:30:00,,America/New_York,,"Sanibel Island, Florida, USA",Program Chairs,"Katia Sycara,John Mylopoulos",,,,,,http://iswc2003.semanticweb.org/,,http://iswc2003.semanticweb.org/sunset2%20crop%20distort2.gif,
http://data.semanticweb.org/conference/iswc/2003,http://data.semanticweb.org/conference/iswc,,http://data.semanticweb.org/ns/swc/ontology#ConferenceEvent,The Second International Semantic Web Conference,2003-10-20T08:00:00,2003-10-23T17:30:00,,America/New_York,,"Sanibel Island, Florida, USA",Publicity Chair,Mike Dean,,,,,,http://iswc2003.semanticweb.org/,,http://iswc2003.semanticweb.org/sunset2%20crop%20distort2.gif,
http://data.semanticweb.org/conference/iswc/2003,http://data.semanticweb.org/conference/iswc,,http://data.semanticweb.org/ns/swc/ontology#ConferenceEvent,The Second International Semantic Web Conference,2003-10-20T08:00:00,2003-10-23T17:30:00,,America/New_York,,"Sanibel Island, Florida, USA",Poster Chair,Raphael M Malyankar,,,,,,http://iswc2003.semanticweb.org/,,http://iswc2003.semanticweb.org/sunset2%20crop%20distort2.gif,
http://data.semanticweb.org/conference/iswc/2003,http://data.semanticweb.org/conference/iswc,,http://data.semanticweb.org/ns/swc/ontology#ConferenceEvent,The Second International Semantic Web Conference,2003-10-20T08:00:00,2003-10-23T17:30:00,,America/New_York,,"Sanibel Island, Florida, USA",Workshop Chair,"Sheila McIlraith,Dimitris Plexousakis",,,,,,http://iswc2003.semanticweb.org/,,http://iswc2003.semanticweb.org/sunset2%20crop%20distort2.gif,
http://data.semanticweb.org/conference/iswc/2003,http://data.semanticweb.org/conference/iswc,,http://data.semanticweb.org/ns/swc/ontology#ConferenceEvent,The Second International Semantic Web Conference,2003-10-20T08:00:00,2003-10-23T17:30:00,,America/New_York,,"Sanibel Island, Florida, USA",Metadata Chair,Steffen Staab,,,,,,http://iswc2003.semanticweb.org/,,http://iswc2003.semanticweb.org/sunset2%20crop%20distort2.gif,
