author,title,pages,year,link_open_access,link_publisher,proceedings_uri,paper_uri,label_proceedings,subtitle_proceedings,abstract,category,keywords,cnt_keyword,topics,cnt_topic,list_author,cnt_author,list_url,cnt_url
"Edgar Meij,Marc Bron,Laura Hollink,Bouke Huurnink and Maarten de Rijke",Learning Semantic Query Suggestions,424-440,2009,http://data.semanticweb.org/pdfs/iswc/2009/paper501.pdf,http://dx.doi.org/10.1007/978-3-642-04930-9_27,http://data.semanticweb.org/conference/iswc/2009/proceedings,http://data.semanticweb.org/conference/iswc/2009/proceedings/paper-24,The Semantic Web - ISWC 2009,"8th International Semantic Web Conference, ISWC 2009, Chantilly, VA, USA, October 25-29, 2009. Proceedings","An important application of semantic web technology is recognizing human-defined concepts in text. Query transformation is a strategy often used in search engines to derive queries that are able to return more useful search results than the original query and most popular search engines provide facilities that let users complete, specify, or reformulate their queries. We study the problem of semantic query suggestion, a special type of query transformation based on identifying semantic concepts contained in user queries. We use a feature-based approach in conjunction with supervised machine learning, augmenting term-based features with search history-based and concept-specific features. We apply our method to the task of linking queries from real-world query logs (the transaction logs of the Netherlands Institute for Sound and Vision) to the DBpedia knowledge base. We evaluate the utility of different machine learning algorithms, features, and feature types in identifying semantic concepts using a manually developed test bed and show significant improvements over an already high baseline. The resources developed for this paper, i.e., queries, human assessments, and extracted features, are available for download.",Research Track Paper,,0,,0,Marc Bron;Maarten de Rijke;Laura Hollink;Edgar Meij;Bouke Huurnink,5,"http://dx.doi.org/10.1007/978-3-642-04930-9_27,http://data.semanticweb.org/pdfs/iswc/2009/paper501.pdf",2
"Roland Stühmer,Darko Anicic,Sinan Sen,Jun Ma,Kay-Uwe Schmidt and Nenad Stojanovic",Lifting events in RDF from interactions with annotated Web pages,893-908,2009,http://kcap09.stanford.edu/share/posterDemos/145/paper145.pdf,http://dx.doi.org/10.1007/978-3-642-04930-9_56,http://data.semanticweb.org/conference/iswc/2009/proceedings,http://data.semanticweb.org/conference/iswc/2009/proceedings/paper-56,The Semantic Web - ISWC 2009,"8th International Semantic Web Conference, ISWC 2009, Chantilly, VA, USA, October 25-29, 2009. Proceedings","In this demo we show the current state of our client-side rule engine for the Web. The engine is an implementation for creating and processing semantic events from interaction with Web pages which opens possibilities to build event-driven applications for the (Semantic) Web. Events, simple or complex, are models for things that happen e.g., when a user interacts with a Web page. Events are consumed in some meaningful way e.g., for monitoring reasons or to trigger actions such as responses. In order for receiving parties to understand events, i.e. comprehend what has led to an event, we demonstrate a general event schema using RDFS.",Semantic Web In Use Track Paper,,0,,0,Kay-Uwe Schmidt;Roland Stühmer;Nenad Stojanovic;Jun Ma;Sinan Sen;Darko Anicic,6,"http://dx.doi.org/10.1007/978-3-642-04930-9_56,http://kcap09.stanford.edu/share/posterDemos/145/paper145.pdf",2
"Sören Auer,Jens Lehmann and Sebastian Hellmann",LinkedGeoData: Adding a Spatial Dimension to the Web of Data,731-746,2009,http://data.semanticweb.org/pdfs/iswc/2009/in-use/paper207.pdf,http://dx.doi.org/10.1007/978-3-642-04930-9_46,http://data.semanticweb.org/conference/iswc/2009/proceedings,http://data.semanticweb.org/conference/iswc/2009/proceedings/paper-45,The Semantic Web - ISWC 2009,"8th International Semantic Web Conference, ISWC 2009, Chantilly, VA, USA, October 25-29, 2009. Proceedings","In order to employ the Web as a medium for data and information integration, comprehensive datasets and vocabularies are required as they enable the disambiguation and alignment of other data and information. Many real-life information integration and aggregation tasks are impossible without comprehensive background knowledge related to spatial features of the ways, structures and landscapes surrounding us. In this paper we contribute to the generation of a spatial dimension for the Data Web by elaborating on how the collaboratively collected OpenStreetMap data can be transformed and represented adhering to the RDF data model. We describe how this data can be interlinked with other spatial data sets, how it can be made accessible for machines according to the linked data paradigm and for humans by means of a faceted geo-data browser.",Semantic Web In Use Track Paper,,0,,0,Jens Lehmann;Sören Auer;Sebastian Hellmann,3,"http://dx.doi.org/10.1007/978-3-642-04930-9_46,http://data.semanticweb.org/pdfs/iswc/2009/in-use/paper207.pdf",2
"Harith Alani,Martin Szomszor,Ciro Cattuto,Wouter Van den Broeck,Gianluca Correndo and Alain Barrat",Live Social Semantics,698-714,2009,http://data.semanticweb.org/pdfs/iswc/2009/in-use/paper213.pdf,http://dx.doi.org/10.1007/978-3-642-04930-9_44,http://data.semanticweb.org/conference/iswc/2009/proceedings,http://data.semanticweb.org/conference/iswc/2009/proceedings/paper-43,The Semantic Web - ISWC 2009,"8th International Semantic Web Conference, ISWC 2009, Chantilly, VA, USA, October 25-29, 2009. Proceedings","Social interactions are one of the key factors to the success of conferences and similar community gatherings. This paper describes a novel application that integrates data from the semantic web, online social networks, and a real-world contact sensing platform. This application was successfully deployed at ESWC09, and actively used by 139 people. Personal profiles of the participants were automatically generated using several Web~2.0 systems and semantic academic data sources, and integrated in real-time with face-to-face contact networks derived from wearable sensors. Integration of all these heterogeneous data layers made it possible to offer various services to conference attendees to enhance their social experience such as visualisation of contact data, and a site to explore and connect with other participants. This paper describes the architecture of the application, the services we provided, and the results we achieved in this deployment.",Semantic Web In Use Track Paper,,0,,0,Gianluca Correndo;Alain Barrat;Wouter Van den Broeck;Harith Alani;Ciro Cattuto;Martin Szomszor,6,"http://dx.doi.org/10.1007/978-3-642-04930-9_44,http://data.semanticweb.org/pdfs/iswc/2009/in-use/paper213.pdf",2
Gerd Gröner and Steffen Staab,Modeling and Query Patterns for Process Retrieval in OWL,243-259,2009,http://data.semanticweb.org/pdfs/iswc/2009/paper323.pdf,http://dx.doi.org/10.1007/978-3-642-04930-9_16,http://data.semanticweb.org/conference/iswc/2009/proceedings,http://data.semanticweb.org/conference/iswc/2009/proceedings/paper-12,The Semantic Web - ISWC 2009,"8th International Semantic Web Conference, ISWC 2009, Chantilly, VA, USA, October 25-29, 2009. Proceedings","Process modeling is a core task in software engineering in general and in web service modeling in particular. The explicit management of process models for purposes such as process selection and/or process reuse requires flexible and intelligent retrieval of process structures based on process entities and relationships, i.e. process activities, hierarchical relationship between activities and their parts, temporal relationships between activities, conditions on process flows as well as the modeling of domain knowledge. In this paper, we analyze requirements for modeling and querying of process models and present a pattern-oriented approach exploiting OWL-DL representation and reasoning capabilities for expressive process modeling and retrieval.",Research Track Paper,,0,,0,Steffen Staab;Gerd Gröner,2,"http://data.semanticweb.org/pdfs/iswc/2009/paper323.pdf,http://dx.doi.org/10.1007/978-3-642-04930-9_16",2
"Daniela Petrelli,Suvodeep Mazumdar,Aba-Sah Dadzie and Fabio Ciravegna",Multi Visualization and Dynamic Query for Effective Exploration of Semantic Data,505-520,2009,http://data.semanticweb.org/pdfs/iswc/2009/paper335.pdf,http://dx.doi.org/10.1007/978-3-642-04930-9_32,http://data.semanticweb.org/conference/iswc/2009/proceedings,http://data.semanticweb.org/conference/iswc/2009/proceedings/paper-30,The Semantic Web - ISWC 2009,"8th International Semantic Web Conference, ISWC 2009, Chantilly, VA, USA, October 25-29, 2009. Proceedings","Semantic formalisms represent content in a uniform way according to ontologies. This enables manipulation and reasoning via automated means (e.g. Semantic Web services), but limits the users ability to explore the semantic data from a point of view that originates from knowledge representation motivations. We show how, for user consumption, a visualization of semantic data according to some easily graspable dimensions (e.g. space and time) provides effective sense-making of data. In this paper, we look holistically at the interaction between users and semantic data, and propose multiple visualization strategies and dynamic filters to support the exploration of semantic-rich data. We discuss a user evaluation and how interaction challenges could be overcome to create an effective user-centred framework for the visualization and manipulation of semantic data. The approach has been implemented and evaluated on a real company archive.",Research Track Paper,,0,,0,Suvodeep Mazumdar;Fabio Ciravegna;Daniela Petrelli;Aba-Sah Dadzie,4,"http://data.semanticweb.org/pdfs/iswc/2009/paper335.pdf,http://dx.doi.org/10.1007/978-3-642-04930-9_32",2
"Vicky Papavassiliou,Giorgos Flouris,Irini Fundulaki,Dimitris Kotzinos and Vassilis Christophides",On Detecting High-Level Changes in RDF/S KBs,473-488,2009,http://data.semanticweb.org/pdfs/iswc/2009/paper161.pdf,http://dx.doi.org/10.1007/978-3-642-04930-9_30,http://data.semanticweb.org/conference/iswc/2009/proceedings,http://data.semanticweb.org/conference/iswc/2009/proceedings/paper-27,The Semantic Web - ISWC 2009,"8th International Semantic Web Conference, ISWC 2009, Chantilly, VA, USA, October 25-29, 2009. Proceedings","An increasing number of scientific communities rely on Semantic Web ontologies to share and interpret data within and across research domains. These common knowledge representation resources are usually developed and maintained manually and essentially co-evolve along with experimental evidence produced by scientists worldwide. Detecting automatically the differences between (two) versions of the same ontology in order to store or visualize their deltas is a challenging task for e-science. In this paper, we focus on languages allowing the formulation of concise and intuitive deltas, which are expressive enough to describe unambiguously any possible change and that can be effectively and efficiently detected. We propose a specific language that provably exhibits those characteristics and provide a change detection algorithm which is sound and complete with respect to the proposed language. Finally, we provide a promising experimental evaluation of our framework using real ontologies from the cultural and bioinformatics domains.",Research Track Paper,,0,,0,Dimitris Kotzinos;Vicky Papavassiliou;Vassilis Christophides;Irini Fundulaki;Giorgos Flouris,5,"http://dx.doi.org/10.1007/978-3-642-04930-9_30,http://data.semanticweb.org/pdfs/iswc/2009/paper161.pdf",2
Eva Blomqvist,OntoCase-Automatic Ontology Enrichment Based on Ontology Design Patterns,65-80,2009,http://data.semanticweb.org/pdfs/iswc/2009/paper405.pdf,http://dx.doi.org/10.1007/978-3-642-04930-9_5,http://data.semanticweb.org/conference/iswc/2009/proceedings,http://data.semanticweb.org/conference/iswc/2009/proceedings/paper-40,The Semantic Web - ISWC 2009,"8th International Semantic Web Conference, ISWC 2009, Chantilly, VA, USA, October 25-29, 2009. Proceedings","OntoCase is a framework for semi-automatic pattern-based ontology construction. In this paper we focus on the retain and reuse phases, where an initial ontology is enriched based on content ontology design patterns (Content ODPs), and especially the implementation and evaluation of these phases. Applying Content ODPs within semiautomatic ontology construction, i.e. ontology learning (OL), is a novel approach. The main contributions of this paper are the methods for pattern ranking, selection, and integration, and the subsequent evaluation showing the characteristics of ontologies constructed automatically based on ODPs. We show that it is possible to improve the results of existing OL methods by selecting and reusing Content ODPs. OntoCase is able to introduce a general top structure into the ontologies, and by exploiting background knowledge the ontology is given a richer overall structure.",Research Track Paper,,0,,0,Eva Blomqvist,1,"http://dx.doi.org/10.1007/978-3-642-04930-9_5,http://data.semanticweb.org/pdfs/iswc/2009/paper405.pdf",2
Heiko Paulheim,Ontologies for User Interface Integration,973-981,2009,http://kcap09.stanford.edu/share/posterDemos/101/paper101.pdf,http://dx.doi.org/10.1007/978-3-642-04930-9_63,http://data.semanticweb.org/conference/iswc/2009/proceedings,http://data.semanticweb.org/conference/iswc/2009/proceedings/paper-64,The Semantic Web - ISWC 2009,"8th International Semantic Web Conference, ISWC 2009, Chantilly, VA, USA, October 25-29, 2009. Proceedings","Application integration can be carried out on three different levels: the data source level, the business logic level, and the user interface level. With ontologies-based integration on the data source level dating back to the 1990s and semantic web services for integrating on the business logic level coming of age, it is time for the next logical step: employing ontologies for integration on the user interface level. Such an approach will improve both the development times and the usability of integrated applications. In this poster, we present an approach employing ontologies for integrating applications on the user interface level.",Poster/Demo Paper,,0,,0,Heiko Paulheim,1,"http://dx.doi.org/10.1007/978-3-642-04930-9_63,http://kcap09.stanford.edu/share/posterDemos/101/paper101.pdf",2
Eric B. Wolf,Ontology-Driven Generalization of Cartographic Representations by Aggregation and Dimensional Collapse,990-997,2009,,http://dx.doi.org/10.1007/978-3-642-04930-9_65,http://data.semanticweb.org/conference/iswc/2009/proceedings,http://data.semanticweb.org/conference/iswc/2009/proceedings/paper-66,The Semantic Web - ISWC 2009,"8th International Semantic Web Conference, ISWC 2009, Chantilly, VA, USA, October 25-29, 2009. Proceedings",,Doctoral Consortium Paper,,0,,0,Eric B. Wolf,1,http://dx.doi.org/10.1007/978-3-642-04930-9_65,1
Freddy Lécué,Optimizing QoS-Aware Semantic Web Service Composition,375-391,2009,http://data.semanticweb.org/pdfs/iswc/2009/paper305.pdf,http://dx.doi.org/10.1007/978-3-642-04930-9_24,http://data.semanticweb.org/conference/iswc/2009/proceedings,http://data.semanticweb.org/conference/iswc/2009/proceedings/paper-21,The Semantic Web - ISWC 2009,"8th International Semantic Web Conference, ISWC 2009, Chantilly, VA, USA, October 25-29, 2009. Proceedings","Ranking and optimization of web service compositions are some of the most interesting challenges at present. Since web services can be enhanced with formal semantic descriptions, forming the semantic web services, it becomes conceivable to exploit the quality of semantic links between services (of any composition) as one of the optimization criteria. For this we propose to use the semantic similarities between output and input parameters of web services. Coupling this with other criteria such as quality of service (QoS) allow us to rank and optimize compositions achieving the same goal. Here we suggest an innovative and extensible optimization model designed to balance semantic fit (or functional quality) with non-functional QoS metrics. To allow the use of this model in the context of a large number of services as foreseen by the strategic EC-funded project SOA4All we propose and test the use of Genetic Algorithms.",Research Track Paper,,0,,0,Freddy Lécué,1,"http://data.semanticweb.org/pdfs/iswc/2009/paper305.pdf,http://dx.doi.org/10.1007/978-3-642-04930-9_24",2
Shirin Sohrabi and Sheila A. McIlraith,Optimizing Web Service Composition while Enforcing Regulations,601-617,2009,http://data.semanticweb.org/pdfs/iswc/2009/paper387.pdf,http://dx.doi.org/10.1007/978-3-642-04930-9_38,http://data.semanticweb.org/conference/iswc/2009/proceedings,http://data.semanticweb.org/conference/iswc/2009/proceedings/paper-36,The Semantic Web - ISWC 2009,"8th International Semantic Web Conference, ISWC 2009, Chantilly, VA, USA, October 25-29, 2009. Proceedings","To direct automated Web service composition, it is compelling to provide a template, workflow or scaffolding that dictates the ways in which services can be composed. In this paper we present an approach to Web service composition that builds on work using AI planning, and more specifically Hierarchical Task Networks (HTNs), for Web service composition. A significant advantage of our approach is that it provides much of the how-to knowledge of a choreography while enabling customization and optimization of integrated Web service selection and composition based upon the needs of the specific problem, the preferences of the customer, and the available services. Many customers must also be concerned with enforcement of regulations, perhaps in the form of corporate policies and/or government regulations. Regulations are traditionally enforced at design time by verifying that a workflow or composition adheres to regulations. Our approach supports customization, optimization and regulation enforcement all at composition construction time. To maximize efficiency, we have developed novel search heuristics together with a branch and bound search algorithm that enable the generation of high quality compositions with the performance of state-of-the-art planning systems.",Research Track Paper,,0,,0,Shirin Sohrabi;Sheila A. McIlraith,2,"http://dx.doi.org/10.1007/978-3-642-04930-9_38,http://data.semanticweb.org/pdfs/iswc/2009/paper387.pdf",2
Jesse Weaver and James A. Hendler,Parallel Materialization of the Finite RDFS Closure for Hundreds of Millions of Triples,682-697,2009,http://data.semanticweb.org/pdfs/iswc/2009/paper241.pdf,http://dx.doi.org/10.1007/978-3-642-04930-9_43,http://data.semanticweb.org/conference/iswc/2009/proceedings,http://data.semanticweb.org/conference/iswc/2009/proceedings/paper-42,The Semantic Web - ISWC 2009,"8th International Semantic Web Conference, ISWC 2009, Chantilly, VA, USA, October 25-29, 2009. Proceedings","In this paper, we consider the problem of materializing the complete finite RDFS closure in a scalable manner; this includes those parts of the RDFS closure that are often ignored such as literal generalization and container membership properties. We point out characteristics of RDFS that allow us to derive an embarrassingly parallel algorithm for producing said closure, and we evaluate our C/MPI implementation of the algorithm on a cluster with 128 cores using different-size subsets of the LUBM 10,000-university data set. We show that the time to produce inferences scales linearly with the number of processes, evaluating this behavior on up to hundreds of millions of triples. We also show the number of inferences produced for different subsets of LUBM10k. To the best of our knowledge, our work is the first to provide RDFS inferencing on such large data sets in such low times. Finally, we discuss future work in terms of promising applications of this approach including OWL2RL rules, MapReduce implementations, and massive scaling on supercomputers.",Research Track Paper,,0,,0,Jesse Weaver;James A. Hendler,2,"http://dx.doi.org/10.1007/978-3-642-04930-9_43,http://data.semanticweb.org/pdfs/iswc/2009/paper241.pdf",2
"Oshani Seneviratne,Lalana Kagal and Tim Berners-Lee",Policy-Aware Content Reuse on the Web,553-568,2009,http://data.semanticweb.org/pdfs/iswc/2009/paper375.pdf,http://dx.doi.org/10.1007/978-3-642-04930-9_35,http://data.semanticweb.org/conference/iswc/2009/proceedings,http://data.semanticweb.org/conference/iswc/2009/proceedings/paper-33,The Semantic Web - ISWC 2009,"8th International Semantic Web Conference, ISWC 2009, Chantilly, VA, USA, October 25-29, 2009. Proceedings","The Web allows users to share their work very effectively leading to the rapid re-use and remixing of content on the Web including text, images, and videos. Scientific research data, social networks, blogs, photo sharing sites and other such applications known collectively as the Social Web have lots of increasingly complex information. Such information from several Web pages can be very easily aggregated, mashed up and presented in other Web pages. Content generation of this nature inevitably leads to many copyright and license violations, motivating research into effective methods to detect and prevent such violations. This is supported by an experiment on Creative Commons (CC) attribution license violations from samples of Web sites that had at least one embedded Flickr image, which revealed that the attribution license violation rate of Flickr images on the Web is around 70-90%. Our primary objective is to enable users to do the right thing and comply with CC licenses associated with Web media, instead of preventing them from doing the wrong thing or detecting violations of these licenses. As a solution, we have implemented two applications: (1) Attribution License Violations Validator, which can be used to validate users' derived work against attribution licenses of reused media and, (2) Semantic Clipboard, which provides license awareness of Web media and enables users to copy them along with the appropriate license metadata.",Research Track Paper,,0,,0,Lalana Kagal;Oshani Seneviratne;Tim Berners-Lee,3,"http://data.semanticweb.org/pdfs/iswc/2009/paper375.pdf,http://dx.doi.org/10.1007/978-3-642-04930-9_35",2
"Tom M. Mitchell,Justin Betteridge,Andrew Carlson,Estevam R. Hruschka Jr. and Richard C. Wang",Populating the Semantic Web by Macro-reading Internet Text,998-1002,2009,,http://dx.doi.org/10.1007/978-3-642-04930-9_66,http://data.semanticweb.org/conference/iswc/2009/proceedings,http://data.semanticweb.org/conference/iswc/2009/proceedings/paper-67,The Semantic Web - ISWC 2009,"8th International Semantic Web Conference, ISWC 2009, Chantilly, VA, USA, October 25-29, 2009. Proceedings","A key question to the future of the semantic web is “how will we acquire structured information to populate the semantic web on a vast scale?” One approach is to enter this information manually. A second approach is to take advantage of the great deal of structured information already present in various databases, and to develop common ontologies, publishing standards, and reward systems to make this data widely accessible. We consider here a third approach: developing software that automatically extracts structured information from unstructured text present on the web. This talk will survey attempts to extract structured knowledge from unstructured text, and will focus on an approach with three characteristics that we hypothesize make it viable. First, in contrast to the very difficult problem of reading information from a single document, we consider the much easier problem of reading hundreds of millions of documents simultaneously, so that our system can extract facts that are stated manytimes by combining evidence from many documents. Second, our system begins with a given ontology that defines the types of information to be extracted, enabling it to focus its effort and to ignore most of the text that is irrelevant to the target ontology. Third, the system uses a new class of semi-supervised learning algorithms to learn how to extract information from web pages -- algorithms designed to achieve greater accuracy when given more complex ontologies. Our experiments show that this approach can produce knowledge bases containing tens of thousands of facts to populate given ontologies with approximately 90% accuracy, starting with only a handful of labeled training examples and 200 million unlabeled web pages.",Invited Talk Paper,,0,,0,Tom M. Mitchell;Justin Betteridge;Andrew Carlson;Richard C. Wang;Estevam R. Hruschka Jr.,5,http://dx.doi.org/10.1007/978-3-642-04930-9_66,1
