author,title,pages,year,link_open_access,link_publisher,proceedings_uri,paper_uri,source_uri,keywords,abstract,uri_me,category,source,EOL
"Catia Pesquita, Cosmin Stroe, Daniel Faria, Emanuel Santos, Isabel Cruz, Francisco Couto","What's in a 'nym'? Synonyms in Biomedical Ontology Matching",513-528,2013,https://github.com/lidingpku/iswc-archive/raw/master/paper/iswc-2013/82180513-what-s-in-a-nym-synonyms-in-biomedical-ontology-matching.pdf,http://www.springer.com/computer/ai/book/978-3-642-41334-6,http://data.semanticweb.org/conference/iswc/2013/proceedings-1,,,"Ontology Matching, Synonym Derivation, Ontology Exten- sion, Biomedical Ontologies","To bring the Life Sciences domain closer to a Semantic Web realization it is fundamental to establish meaningful relations between biomedical ontologies. The successful application of ontology matching techniques is strongly tied to an eﬀective exploration of the complex and diverse biomedical terminology contained in biomedical ontologies. In this paper, we present an overview of the lexical components of several biomedical ontologies and investigate how diﬀerent approaches for their use can impact the performance of ontology matching techniques. We propose novel approaches for exploring the diﬀerent types of synonyms encoded by the ontologies and for extending them based both on internal synonym derivation and on external ontologies. We evaluate our approaches using AgreementMaker, a successful ontology matching platform that implements several lexical matchers, and apply them to a set of four benchmark biomedical ontology matching tasks. Our results demonstrate the impact that an adequate consideration of ontology synonyms can have on matching performance, and validate our novel approach for combining internal and external synonym sources as a competitive and in many cases improved solution for biomedical ontology matching.",http://data.semanticweb.org/conference/iswc/2013,"Research Track Paper",http://www.iswc2013.semanticweb.org/content/accepted-papers,EOL
"Jay Pujara, Hui Miao, Lise Getoor, William Cohen","Knowledge Graph Identification",529-544,2013,https://github.com/lidingpku/iswc-archive/raw/master/paper/iswc-2013/82180529-knowledge-graph-identification.pdf,http://www.springer.com/computer/ai/book/978-3-642-41334-6,http://data.semanticweb.org/conference/iswc/2013/proceedings-1,,,,"Large-scale information processing systems are able to extract massive collections of interrelated facts, but unfortunately transforming these candidate facts into useful knowledge is a formidable challenge. In this paper, we show how uncertain extractions about entities and their relations can be transformed into a know ledge graph. The extractions form an extraction graph and we refer to the task of removing noise, inferring missing information, and determining which candidate facts should be included into a knowledge graph as know ledge graph identiﬁcation. In order to perform this task, we must reason jointly about candidate facts and their associated extraction conﬁdences, identify coreferent entities, and incorporate ontological constraints. Our proposed approach uses probabilistic soft logic (PSL), a recently introduced probabilistic modeling framework which easily scales to millions of facts. We demonstrate the power of our method on a synthetic Linked Data corpus derived from the MusicBrainz music community and a real-world set of extractions from the NELL pro ject containing over 1M extractions and 70K ontological relations. We show that compared to existing methods, our approach is able to achieve improved AUC and F1 with signiﬁcantly lower running time.",http://data.semanticweb.org/conference/iswc/2013,"Research Track Paper",http://www.iswc2013.semanticweb.org/content/accepted-papers,EOL
"Mariano Rodriguez-Muro, Roman Kontchakov, Michael Zakharyaschev","Ontology-Based Data Access: Ontop of Databases",545-560,2013,https://github.com/lidingpku/iswc-archive/raw/master/paper/iswc-2013/82180545-ontology-based-data-access-ontop-of-databases.pdf,http://www.springer.com/computer/ai/book/978-3-642-41334-6,http://data.semanticweb.org/conference/iswc/2013/proceedings-1,,,,"We present the architecture and technologies underpinning the OBDA system Ontop and taking full advantage of storing data in relational databases. We discuss the theoretical foundations of Ontop : the tree-witness query rewriting, T -mappings and optimisations based on database integrity constraints and SQL features. We analyse the performance of Ontop in a series of experiments and demonstrate that, for standard ontologies, queries and data stored in relational databases, Ontop is fast, eﬃcient and produces SQL rewritings of high quality.",http://data.semanticweb.org/conference/iswc/2013,"Research Track Paper",http://www.iswc2013.semanticweb.org/content/accepted-papers,EOL
"Muhammad Saleem, Axel-Cyrille Ngonga Ngomo, Josiane Xavier Parreira, Helena Deus, Manfred Hauswirth","DAW: Duplicate-AWare Federated Query Processing over the Web of Data",561-576,2013,https://github.com/lidingpku/iswc-archive/raw/master/paper/iswc-2013/82180561-daw-duplicate-aware-federated-query-processing-over-the-web-of-data.pdf,http://www.springer.com/computer/ai/book/978-3-642-41334-6,http://data.semanticweb.org/conference/iswc/2013/proceedings-1,,,"federated query processing, SPARQL, min-wise indepen- dent permutations, Web of Data","Over the last years the Web of Data has developed into a large compendium of interlinked data sets from multiple domains. Due to the decentralised architecture of this compendium, several of these datasets contain duplicated data. Yet, so far, only little attention has been paid to the eﬀect of duplicated data on federated querying. This work presents DAW, a novel duplicate-aware approach to federated querying over the Web of Data. DAW is based on a combination of min-wise independent permutations and compact data summaries. It can be directly combined with existing federated query engines in order to achieve the same query recall values while querying fewer data sources. We extend three well-known federated query processing engines – DARQ, SPLENDID, and FedX – with DAW and compare our extensions with the original approaches. The comparison shows that DAW can greatly reduce the number of queries sent to the endpoints, while keeping high query recall values. Therefore, it can signiﬁcantly improve the performance of federated query processing engines. Moreover, DAW provides a source selection mechanism that maximises the query recall, when the query processing is limited to a subset of the sources.",http://data.semanticweb.org/conference/iswc/2013,"Research Track Paper",http://www.iswc2013.semanticweb.org/content/accepted-papers,EOL
"Heiner Stuckenschmidt, Michael Schuhmacher, Johannes Knopp, Christian Meilicke, Ansgar Scherp","On the Status of Experimental Research on the Semantic Web",577-592,2013,https://github.com/lidingpku/iswc-archive/raw/master/paper/iswc-2013/82180577-on-the-status-of-experimental-research-on-the-semantic-web.pdf,http://www.springer.com/computer/ai/book/978-3-642-41334-6,http://data.semanticweb.org/conference/iswc/2013/proceedings-1,,,,"Experimentation is an important way to validate results of Semantic Web and Computer Science research in general. In this paper, we investigate the development and the current status of experimental work on the Semantic Web. Based on a corpus of 500 papers collected from the International Semantic Web Conferences (ISWC) over the past decade, we analyse the importance and the quality of experimental research conducted and compare it to general Computer Science. We observe that the amount and quality of experiments are steadily increasing over time. Unlike hypothesised, we cannot conﬁrm a statistically signiﬁcant correlation between a paper’s citations and the amount of experimental work reported. Our analysis, however, shows that papers comparing themselves to other systems are more often cited than other papers.",http://data.semanticweb.org/conference/iswc/2013,"Research Track Paper",http://www.iswc2013.semanticweb.org/content/accepted-papers,EOL
"Mohsen Taheriyan, Craig Knoblock, Pedro Szekely, José Luis Ambite","A Graph-Based Approach to Learn Semantic Descriptions of Data Sources",593-608,2013,https://github.com/lidingpku/iswc-archive/raw/master/paper/iswc-2013/82180593-a-graph-based-approach-to-learn-semantic-descriptions-of-data-sources.pdf,http://www.springer.com/computer/ai/book/978-3-642-41334-6,http://data.semanticweb.org/conference/iswc/2013/proceedings-1,,,"semantic description, source modeling, source description, semantic model, Semantic Web","Semantic models of data sources and services provide support to automate many tasks such as source discovery, data integration, and service composition, but writing these semantic descriptions by hand is a tedious and time-consuming task. Most of the related work focuses on automatic annotation with classes or properties of source attributes or input and output parameters. However, constructing a source model that includes the relationships between the attributes in addition to their semantic types remains a largely unsolved problem. In this paper, we present a graph-based approach to hypothesize a rich semantic description of a new target source from a set of known sources that have been modeled over the same domain ontology. We exploit the domain ontology and the known source models to build a graph that represents the space of plausible source descriptions. Then, we compute the top k candidates and suggest to the user a ranked list of the semantic models for the new source. The approach takes into account user corrections to learn more accurate semantic descriptions of future data sources. Our evaluation shows that our method produces models that are twice as accurate than the models produced using a state of the art system that does not learn from prior models.",http://data.semanticweb.org/conference/iswc/2013,"Research Track Paper",http://www.iswc2013.semanticweb.org/content/accepted-papers,EOL
"Aibo Tian, Juan F. Sequeda, Daniel Miranker","QODI: Query as Context in Automatic Data Integration",609-624,2013,https://github.com/lidingpku/iswc-archive/raw/master/paper/iswc-2013/82180609-qodi-query-as-context-in-automatic-data-integration.pdf,http://www.springer.com/computer/ai/book/978-3-642-41334-6,http://data.semanticweb.org/conference/iswc/2013/proceedings-1,,,"QODI, Ontology-based data integration, Query-speciﬁc ontology map- ping","QODI is an automatic ontology-based data integration system (OBDI). QODI is distinguished in that the ontology mapping algorithm dynamically determines a partial mapping speciﬁc to the reformulation of each query. The query provides application context not available in the ontologies alone; thereby the system is able to disambiguate mappings for different queries. The mapping algorithm decomposes the query into a set of paths, and compares the set of paths with a similar decomposition of a source ontology. Using test sets from three real world applications, QODI achieves favorable results compared with AgreementMaker, a leading ontology matcher, and an ontology-based implementation of the mapping methods detailed for Clio, the state-of-the-art relational data integration and data exchange system.",http://data.semanticweb.org/conference/iswc/2013,"Research Track Paper",http://www.iswc2013.semanticweb.org/content/accepted-papers,EOL
"Alberto Tonon, Michele Catasta, Gianluca Demartini, Philippe Cudré-Mauroux, Karl Aberer","TRank: Ranking Entity Types Using the Web of Data",625-640,2013,https://github.com/lidingpku/iswc-archive/raw/master/paper/iswc-2013/82180625-trank-ranking-entity-types-using-the-web-of-data.pdf,http://www.springer.com/computer/ai/book/978-3-642-41334-6,http://data.semanticweb.org/conference/iswc/2013/proceedings-1,,,,"Much of Web search and browsing activity is today centered around entities. For this reason, Search Engine Result Pages (SERPs) increasingly contain information about the searched entities such as pictures, short summaries, related entities, and factual information. A key facet that is often displayed on the SERPs and that is instrumental for many applications is the entity type. However, an entity is usually not associated to a single generic type in the background knowledge bases but rather to a set of more speciﬁc types, which may be relevant or not given the document context. For example, one can ﬁnd on the Linked Open Data cloud the fact that Tom Hanks is a person, an actor, and a person from Concord, California. All those types are correct but some may be too general to be interesting (e.g., person), while other may be interesting but already known to the user (e.g., actor), or may be irrelevant given the current browsing context (e.g., person from Concord, California). In this paper, we deﬁne the new task of ranking entity types given an entity and its context. We propose and evaluate new methods to ﬁnd the most relevant entity type based on collection statistics and on the graph structure interconnecting entities and types. An extensive experimental evaluation over several document collections at diﬀerent levels of granularity (e.g., sentences, paragraphs, etc.) and diﬀerent type hierarchies (including DBPedia, Freebase, and schema.org) shows that hierarchy-based approaches provide more accurate results when picking entity types to be displayed to the end-user while still being highly scalable.",http://data.semanticweb.org/conference/iswc/2013,"Research Track Paper",http://www.iswc2013.semanticweb.org/content/accepted-papers,EOL
"Jacopo Urbani, Alessandro Margara, Ceriel Jacobs, Frank Van Harmelen, Henri Bal","DynamiTE: Parallel Materialization of Dynamic RDF Data",641-656,2013,https://github.com/lidingpku/iswc-archive/raw/master/paper/iswc-2013/82180641-dynamite-parallel-materialization-of-dynamic-rdf-data.pdf,http://www.springer.com/computer/ai/book/978-3-642-41334-6,http://data.semanticweb.org/conference/iswc/2013/proceedings-1,,,,"One of the main advantages of using semantically annotated data is that machines can reason on it, deriving implicit knowledge from explicit information. In this context, materializing every possible implicit derivation from a given input can be computationally expensive, especially when considering large data volumes. Most of the solutions that address this problem rely on the assumption that the information is static, i.e., that it does not change, or changes very infrequently. However, the Web is extremely dynamic: online newspapers, blogs, social networks, etc., are frequently changed so that outdated information is removed and replaced with fresh data. This demands for a materialization that is not only scalable, but also reactive to changes. In this paper, we consider the problem of incremental materialization, that is, how to update the materialized derivations when new data is added or removed. To this purpose, we consider the ρdf RDFS fragment [12], and present a parallel system that implements a number of algorithms to quickly recalculate the derivation. In case new data is added, our system uses a parallel version of the well-known semi-naive evaluation of Datalog. In case of removals, we have implemented two algorithms, one based on previous theoretical work, and another one that is more eﬃcient since it does not require a complete scan of the input. We have evaluated the performance using a prototype system called DynamiTE , which organizes the knowledge bases with a number of indices to facilitate the query process and exploits parallelism to improve the performance. The results show that our methods are indeed capable to recalculate the derivation in a short time, opening the door to reasoning on much more dynamic data than is currently possible.",http://data.semanticweb.org/conference/iswc/2013,"Research Track Paper",http://www.iswc2013.semanticweb.org/content/accepted-papers,EOL
"Mengling Xu, Zhichun Wang, Rongfang Bie, Juanzi Li, Chen Zheng, Wantian Ke, Mingquan Zhou","Discovering Missing Semantic Relations between Entities in Wikipedia",657-670,2013,https://github.com/lidingpku/iswc-archive/raw/master/paper/iswc-2013/82180657-discovering-missing-semantic-relations-between-entities-in-wikipedia.pdf,http://www.springer.com/computer/ai/book/978-3-642-41334-6,http://data.semanticweb.org/conference/iswc/2013/proceedings-1,,,"Wikipedia, Infobox, Linked Data","Wikipedia’s infoboxes contain rich structured information of various entities, which have been explored by the DBpedia pro ject to generate large scale Linked Data sets. Among all the infobox attributes, those attributes having hyperlinks in its values identify semantic relations between entities, which are important for creating RDF links between DBpedia’s instances. However, quite a few hyperlinks have not been anotated by editors in infoboxes, which causes lots of relations between entities being missing in Wikipedia. In this paper, we propose an approach for automatically discovering the missing entity links in Wikipedia’s infoboxes, so that the missing semantic relations between entities can be established. Our approach ﬁrst identiﬁes entity mentions in the given infoboxes, and then computes several features to estimate the possibilities that a given attribute value might link to a candidate entity. A learning model is used to obtain the weights of diﬀerent features, and predict the destination entity for each attribute value. We evaluated our approach on the English Wikipedia data, the experimental results show that our approach can eﬀectively ﬁnd the missing relations between entities, and it signiﬁcantly outperforms the baseline methods in terms of both precision and recall.",http://data.semanticweb.org/conference/iswc/2013,"Research Track Paper",http://www.iswc2013.semanticweb.org/content/accepted-papers,EOL
"Xingjian Zhang, Dezhao Song, Sambhawa Priya, Jeff Heflin","Infrastructure for Efficient Exploration of Large Scale Linked Data via Contextual Tag Clouds",671-686,2013,https://github.com/lidingpku/iswc-archive/raw/master/paper/iswc-2013/82180671-infrastructure-for-efficient-exploration-of-large-scale-linked-data-via-contextual-tag-clouds.pdf,http://www.springer.com/computer/ai/book/978-3-642-41334-6,http://data.semanticweb.org/conference/iswc/2013/proceedings-1,,,"Ontology visualization, indented tree, graph, usability study","In this paper we present the infrastructure of the contextual tag cloud system which can execute large volumes of queries about the number of instances that use particular ontological terms. The contextual tag cloud system is a novel application that helps users explore a large scale RDF dataset: the tags are ontological terms (classes and properties), the context is a set of tags that deﬁnes a subset of instances, and the font sizes reﬂect the number of instances that use each tag. It visualizes the patterns of instances speciﬁed by the context a user constructs. Given a request with a speciﬁc context, the system needs to quickly ﬁnd what other tags the instances in the context use, and how many instances in the context use each tag. The key question we answer in this paper is how to scale to Linked Data; in particular we use a dataset with 1.4 billion triples and over 380,000 tags. This is complicated by the fact that the calculation should, when directed by the user, consider the entailment of taxonomic and/or domain/range axioms in the ontology. We combine a scalable preprocessing approach with a specially-constructed inverted index and use three approaches to prune unnecessary counts for faster intersection computations. We compare our system with a state-of-the-art triple store, examine how pruning rules interact with inference and analyze our design choices.",http://data.semanticweb.org/conference/iswc/2013,"Research Track Paper",http://www.iswc2013.semanticweb.org/content/accepted-papers,EOL
"Ziqi Zhang, Anna Lisa Gentile, Eva Blomqvist, Isabelle Augenstein, Fabio Ciravegna","Statistical Knowledge Patterns: Identifying Synonymous Relations in Large Linked Datasets",687-702,2013,https://github.com/lidingpku/iswc-archive/raw/master/paper/iswc-2013/82180687-statistical-knowledge-patterns-identifying-synonymous-relations-in-large-linked-datasets.pdf,http://www.springer.com/computer/ai/book/978-3-642-41334-6,http://data.semanticweb.org/conference/iswc/2013/proceedings-1,,,,"The Web of Data is a rich common resource with billions of triples available in thousands of datasets and individual Web documents created by both expert and non-expert ontologists. A common problem is the imprecision in the use of vocabularies: annotators can misunderstand the semantics of a class or property or may not be able to ﬁnd the right objects to annotate with. This decreases the quality of data and may eventually hamper its usability over large scale. This paper describes Statistical Knowledge Patterns (SKP) as a means to address this issue. SKPs encapsulate key information about ontology classes, including synonymous properties in (and across) datasets, and are automatically generated based on statistical data analysis. SKPs can be eﬀectively used to automatically normalise data, and hence increase recall in querying. Both pattern extraction and pattern usage are completely automated. The main beneﬁts of SKPs are that: (1) their structure allows for both accurate query expansion and restriction; (2) they are context dependent, hence they describe the usage and meaning of properties in the context of a particular class; and (3) they can be generated oﬄine, hence the equivalence among relations can be used eﬃciently at run time.",http://data.semanticweb.org/conference/iswc/2013,"Research Track Paper",http://www.iswc2013.semanticweb.org/content/accepted-papers,EOL
"Yujiao Zhou, Yavor Nenov, Bernardo Cuenca Grau, Ian Horrocks","Complete Query Answering Over Horn Ontologies Using a Triple Store",703-718,2013,https://github.com/lidingpku/iswc-archive/raw/master/paper/iswc-2013/82180703-complete-query-answering-over-horn-ontologies-using-a-triple-store.pdf,http://www.springer.com/computer/ai/book/978-3-642-41334-6,http://data.semanticweb.org/conference/iswc/2013/proceedings-1,,,,"In our previous work, we showed how a scalable OWL 2 RL reasoner can be used to compute both lower and upper bound query answers over very large datasets and arbitrary OWL 2 ontologies. However, when these bounds do not coincide, there still remain a number of possible answer tuples whose status is not determined. In this paper, we show how in the case of Horn ontologies one can exploit the lower and upper bounds computed by the RL reasoner to eﬃciently identify a subset of the data and ontology that is large enough to resolve the status of these tuples, yet small enough so that the status can be computed using a fully-ﬂedged OWL 2 reasoner. The resulting hybrid approach has enabled us to compute exact answers to queries over datasets and ontologies where previously only approximate query answering was possible.",http://data.semanticweb.org/conference/iswc/2013,"Research Track Paper",http://www.iswc2013.semanticweb.org/content/accepted-papers,EOL
"Marco Balduini, Emanuele Della Valle, Daniele Dell'Aglio, Themis Palpanas, Mikalai Tsytsarau, Cristian Confalonieri","Social listening of City Scale Events using the Streaming Linked Data Framework",1-16,2013,https://github.com/lidingpku/iswc-archive/raw/master/paper/iswc-2013/82190001-social-listening-of-city-scale-events-using-the-streaming-linked-data-framework.pdf,http://www.springer.com/computer/ai/book/978-3-642-41337-7,http://data.semanticweb.org/conference/iswc/2013/proceedings-2,,,,"City-scale events may easily attract half a million of visitors in hundreds of venues over just a few days. Which are the most attended venues? What do visitors think about them? How do they feel before, during and after the event? These are few of the questions a city-scale event manger would like to see answered in real-time. In this paper, we report on our experience in social listening of two city-scale events (London Olympic Games 2012, and Milano Design Week 2013) using the Streaming Linked Data Framework.",http://data.semanticweb.org/conference/iswc/2013,"Semantic Web In Use Track Paper",http://www.iswc2013.semanticweb.org/content/accepted-papers,EOL
