author,title,pages,year,link_open_access,link_publisher,proceedings_uri,paper_uri,source_uri,keywords,abstract,uri_me,category,source,EOL
"Christoph Pinkel, Carsten Binnig, Evgeny Kharlamov, Peter Haase","IncMap: Pay as you go Matching of Relational Schemata to OWL Ontologies",,2013,,,http://data.semanticweb.org/conference/iswc/2013/poster-demo-proceedings,,,,"Ontology Based Data Access (OBDA) enables access to relational data with a complex structure through ontologies as conceptual domain models. A key component of an OBDA system are mappings between the schematic elements in the ontology and their correspondences in the relational schema. Today, in existing OBDA systems these mappings typically need to be compiled by hand. In this paper we present IncMap, a system that supports a semiautomatic approach for matching relational schemata and ontologies. Our approach is based on a novel matching technique that represents the schematic elements of an ontology and a relational schema in a unified way. Finally, IncMap can extend user-verified mapping suggestions in a pay as you go fashion.",http://data.semanticweb.org/conference/iswc/2013,"Poster/Demo Paper",,EOL
"Alexander Arturo Mera Caraballo, Bernardo Pereira Nunes, Giseli Rabello Lopes, Luiz André P. Paes Leme, Marco Antonio Casanova, Stefan Dietze","TRT - A Tripleset Recommendation Tool",,2013,,,http://data.semanticweb.org/conference/iswc/2013/poster-demo-proceedings,,,,"According to the Linked Data principles, a tripleset should be interlinked with others to take advantage of existing knowledge. However, interlinking is a laborious task. Thus, users interlink their triplesets mostly with data hubs, such as DBpedia and Freebase, ignoring the more specic yet often even more promising triplesets. To alleviate this problem, this paper describes a tripleset interlinking recommendation tool based on link prediction techniques and evaluates the tool on a real-world tripleset repository.",http://data.semanticweb.org/conference/iswc/2013,"Poster/Demo Paper",,EOL
"Bernardo Pereira Nunes, Besnik Fetahu, Stefan Dietze, Marco Antonio Casanova","Cite4Me: A Semantic Search and Retrieval Web Application for Scientific Publications",,2013,,,http://data.semanticweb.org/conference/iswc/2013/poster-demo-proceedings,,,,"Cite4Me is a Web application that leverages Semantic Web technologies to provide a new perspective on search and retrieval of bibliographical data. The Web application presented in this work focuses on: (i) semantic recommendation of papers; (ii) novel semantic search & retrieval of papers; (iii) data interlinking of bibliographical data with related data sources from LOD; (iv) innovative user interface design; and (v) sentiment analysis of extracted paper citations. Finally, as this work also targets some educational aspects, our application provides an in-depth analysis of the data that guides a user on his research field.",http://data.semanticweb.org/conference/iswc/2013,"Poster/Demo Paper",,EOL
"Femke Ongenae, Stijn Verstichel, Maarten Wijnants, Filip De Turck","A Distributed Reasoning Platform to Preserve Energy in Wireless Sensor Networks",,2013,,,http://data.semanticweb.org/conference/iswc/2013/poster-demo-proceedings,,,,"A distributed reasoning platform is presented to reduce the energy consumption of Wireless Sensor Networks (WSNs) offering geospatial services by minimizing the amount of wireless communication. It combines local, rule-based reasoning on the sensors and gateways with global, ontology-based reasoning on the back-end servers. The Semantic Sensor Network (SNN) Ontology was extended to model the WSN energy consumption. Two prototypes are presented: the Personal Parking Assistant (PPA) and Garbage Bin Tampering Monitor (GBTM).",http://data.semanticweb.org/conference/iswc/2013,"Poster/Demo Paper",,EOL
"Saemi Jang, Satria Hutomo, Soon Gill Hong, Mun Yi","Interlinking Multilingual LOD Resources: A Study on Connecting Chinese, Japanese, and Korean Resources Using the Unihan Database",,2013,,,http://data.semanticweb.org/conference/iswc/2013/poster-demo-proceedings,,,,"This study proposes a novel method with which Chinese, Japanese, and Korean (CJK) resources on the Web can be effectively matched and connected. The three countries share Chinese characters even though Japan and Korea have their own language. Utilizing the Unihan database, which covers more than 45,000 characters commonly used by the three countries, we show that the proposed method outperforms the traditional method based on string matching in finding similar characters and words used in these countries. The results represent a first step towards overcoming the multilingual barrier in semantically interlinking Asian LOD resources.",http://data.semanticweb.org/conference/iswc/2013,"Poster/Demo Paper",,EOL
"Peter Patel-Schneider, Pat Hayes","Finite Models in RDF(S), with datatypes",,2013,,,http://data.semanticweb.org/conference/iswc/2013/poster-demo-proceedings,,,,"The details of reasoning in RDF are generally well known.  The model-theoretic characteristcs of RDF have been less studied, particularly when datatypes are added.  RDF reasoning can be performed by only considering finite models or pre-models, and sometimes only very small models need be considered.",http://data.semanticweb.org/conference/iswc/2013,"Poster/Demo Paper",,EOL
"Anastasia Dimou, Miel Vander Sande, Pieter Colpaert, Erik Mannens, Rik Van de Walle","Extending R2RML to a source-independent mapping language for RDF",,2013,,,http://data.semanticweb.org/conference/iswc/2013/poster-demo-proceedings,,,,"Although reaching the fifth star of the Open Data deployment scheme demands the data to be represented in RDF and linked, a generic and standard mapping procedure to deploy raw data in RDF was not established so far. Only the R2RML mapping language was standardized but its applicability is limited to mappings from relational databases to RDF. We propose the extension of R2RML to also support mappings of data sources in other structured formats. Broadening its scope, the focus is put on the mappings and their optimal reuse. The language becomes source-agnostic, and resources are integrated and interlinked at a primary stage.",http://data.semanticweb.org/conference/iswc/2013,"Poster/Demo Paper",,EOL
"Dat Quoc Nguyen, Dai Quoc Nguyen, Son Bao Pham","KbQAS: A Knowledge-based QA System",,2013,,,http://data.semanticweb.org/conference/iswc/2013/poster-demo-proceedings,,,,"In this demo paper, we present the first ontology-based Vietnamese question answeringsystem KbQAS in which a knowledge acquisition approach for question analysis is integrated.",http://data.semanticweb.org/conference/iswc/2013,"Poster/Demo Paper",,EOL
"Alexander Schätzle, Martin Przyjaciel-Zablocki, Thomas Hornung, Georg Lausen","PigSPARQL: A SPARQL Query Processing Baseline for Big Data",,2013,,,http://data.semanticweb.org/conference/iswc/2013/poster-demo-proceedings,,,,"In this paper, we discuss PigSPARQL, a competitive, yet easy to use, SPARQL query processing system based on MapReduce and thus intended for Big Data applications. Instead of a direct mapping, PigSPARQL uses the query language of Pig, a data analysis platform on top of Hadoop, as an intermediate layer between SPARQL and MapReduce. The additional level of abstraction makes our approach independent of the actual Hadoop version. Thus, it is automatically compatible to future changes of the Hadoop framework as they will be neutralized by the Pig layer and allows ad-hoc SPARQL query processing on large RDF graphs out of the box. In the paper we first revisit PigSPARQL and demonstrate PigSPARQL's gain of efficiency simply because switching from version Pig 0.5.0 to Pig 0.11.0. Because of this sustainability, PigSPARQL is an attractive long-term baseline for comparing various MapReduce based SPARQL implementations. This is underlined by PigSPARQL's competitiveness with existing systems, e.g. HadoopRDF.",http://data.semanticweb.org/conference/iswc/2013,"Poster/Demo Paper",,EOL
"Heiko Paulheim, Sven Hertling","Discoverability of SPARQL Endpoints in Linked Open Data",,2013,,,http://data.semanticweb.org/conference/iswc/2013/poster-demo-proceedings,,,,"Accessing Linked Open Data sources with query languages such as SPARQL provides more flexible possibilities than access based on derefencerable URIs only. However, discovering a SPARQL endpoint on the fly, given a URI, is not trivial. This paper provides a quantitative analysis on the automatic discoverability of SPARQL endpoints using different mechanisms.",http://data.semanticweb.org/conference/iswc/2013,"Poster/Demo Paper",,EOL
"Besnik Fetahu, Stefan Dietze, Bernardo Pereira Nunes, Davide Taibi, Marco Antonio Casanova","Profiling of Linked Datasets using Structured Descriptions",,2013,,,http://data.semanticweb.org/conference/iswc/2013/poster-demo-proceedings,,,,"While there exists an increasingly large number of Linked Data, metadata about the content covered by individual datasets is sparse. In this paper, we introduce a processing pipeline to automatically assess, annotate and index available linked datasets. Given a minimal description of a dataset from the DataHub, the process produces a structured RDF-based description that includes information about its main topics. Additionally, the generated descriptions embed datasets into an interlinked graph of datasets based on shared topic vocabularies. We adopt and integrate techniques for Named Entity Recognition and automated data validation, providing a consistent workflow for dataset profiling and annotation. Finally, we validate the results obtained with our tool.",http://data.semanticweb.org/conference/iswc/2013,"Poster/Demo Paper",,EOL
"Pilsik Choi, Jooik Jung, Kyong-Ho Lee","RDFChain: Chain Centric Storage for Scalable Join Processing of RDF Graphs using MapReduce and HBase",,2013,,,http://data.semanticweb.org/conference/iswc/2013/poster-demo-proceedings,,,,"As a massive linked open data is available in RDF, the scalable storage and efficient retrieval using MapReduce have been actively studied. Most of previous researches focus on reducing the number of MapReduce jobs for processing join operations in SPARQL queries. However, the cost of shuffle phase still occurs due to their reduce-side joins. In this paper, we propose RDFChain which supports the scalable storage and efficient retrieval of a large volume of RDF data using a combination of MapReduce and HBase which is NoSQL storage system. Since the proposed storage schema of RDFChain reflects all the possible join patterns of queries, it provides a reduced number of storage accesses depending on the join pattern of a query. In addition, the proposed cost-based map-side join of RDFChain reduces the number of map jobs since it processes as many joins as possible in a map job using statistics.",http://data.semanticweb.org/conference/iswc/2013,"Poster/Demo Paper",,EOL
"Anila Sahar Butt, Armin Haller, Shepherd Liu, Lexing Xie","ActiveRaUL: A Web form-based User Interface to create and maintain RDF data",,2013,,,http://data.semanticweb.org/conference/iswc/2013/poster-demo-proceedings,,,,"With the advent of Linked Data the amount of automatically generated machine-readable data on the Web, often obtained by means of mapping relational data to RDF, has risen significantly. However, manually created, quality-assured and crowd-sourced data based on ontologies, is not available in the quantities that would realise the full potential of the semantic Web. One of the barriers for semantic Web novices to create machine-readable data, is the lack of easy-to-use Web publishing tools that separate the schema modelling from the data creation. In this demonstration we present ActiveRaUL, a Web service that supports the automatic generation of Web form-based user interfaces from any input ontology. The resulting Web forms are unique in supporting users, inexperienced in semantic Web technologies, to create and maintain RDF data modelled according to an ontology. We report on a use case based on the Sensor Network Ontology that supports the viability of our approach.",http://data.semanticweb.org/conference/iswc/2013,"Poster/Demo Paper",,EOL
"Zhigang Wang, Juanzi Li, Zhichun Wang, Shuangjie Li, Mingyang Li, Dongsheng Zhang, Yao Shi, Yongbin Liu, Jie Tang","XLore: A Large-scale English-Chinese Bilingual Knowledge Graph",,2013,,,http://data.semanticweb.org/conference/iswc/2013/poster-demo-proceedings,,,,"Current Wikipedia-based multilingual knowledge bases still suffer the following problems: (i) the scarcity of non-English knowledge, (ii) the noise in the semantic relations and (iii) the limited coverage of equivalent cross-lingual entities. In this demo, we present a large-scale bilingual knowledge graph named XLore, which has adequately solved the above problems.",http://data.semanticweb.org/conference/iswc/2013,"Poster/Demo Paper",,EOL
"Tom De Nies, Sara Magliacane, Ruben Verborgh, Sam Coppens, Paul Groth, Erik Mannens, Rik Van de Walle","Git2PROV: Exposing Version Control System Content as W3C PROV",,2013,,,http://data.semanticweb.org/conference/iswc/2013/poster-demo-proceedings,,,,"Data provenance is defined as information about entities, activities and people producing or modifying a piece of data. On the Web, the interchange of standardized provenance of (linked) data is an essential step towards establishing trust. One mechanism to track (part of) the provenance of data, is through the use of version control systems (VCS), such as Git. These systems are widely used to facilitate collaboration primarily for both code and data. Here, we describe a system to expose the provenance stored in VCS in a new standard Web-native format: W3C PROV. This enables the easy publication of VCS provenance on the Web and subsequent integration with other systems that make use of PROV. The system is exposed as a RESTful Web service, which allows integration into user-friendly tools, such as browser plugins.",http://data.semanticweb.org/conference/iswc/2013,"Poster/Demo Paper",,EOL
"Charith Perera, Arkady Zaslavsky, Michael Compton, Peter Christen, Dimitrios Georgakopoulos","Context Aware Sensor Configuration Model for Internet of Things",,2013,,,http://data.semanticweb.org/conference/iswc/2013/poster-demo-proceedings,,,,"We propose a Context Aware Sensor Configuration Model (CASCoM) to address the challenge of automated context-aware configuration of filtering, fusion, and reasoning mechanisms in IoT middleware according to the problems at hand. We incorporate semantic technologies in solving the above challenges.",http://data.semanticweb.org/conference/iswc/2013,"Poster/Demo Paper",,EOL
"Steven Lynden, Isao Kojima, Akiyoshi Matono, Akihito Nakamura","Best-effort Linked Data Query Processing with time constraints using ADERIS-Hybrid",,2013,,,http://data.semanticweb.org/conference/iswc/2013/poster-demo-proceedings,,,,"Answering SPARQL queries over the Web of Linked Data is a challenging problem. Approaches based on distributed query processing provide up-to-date results but can suffer from delayed response times, indexing-based approaches provide fast response times but results can be out-of-date and the costs of indexing the growing Web of Linked Data are potentially huge. Hybrid approaches try to offer the best of both. In this demo paper we describe a system for answering SPARQL queries within fixed time constraints by accessing SPARQL endpoints and the Web of Linked Data directly.",http://data.semanticweb.org/conference/iswc/2013,"Poster/Demo Paper",,EOL
"Luca Costabello, Serena Villata, Iacopo Vagliano, Fabien Gandon","Assisted Policy Management for SPARQL Endpoints Access Control",,2013,,,http://data.semanticweb.org/conference/iswc/2013/poster-demo-proceedings,,,,"Shi3ld is a context-aware authorization framework for protecting SPARQL endpoints. It assumes the definition of access policies using RDF and SPARQL, and the specification of named graphs to identify the protected resources. These assumptions lead to the incapability for users who are not familiar with such languages and technologies to use the authorization framework. In this paper, we present a graphical user interface to support dataset administrators to define access policies and the target elements protected by such policies.",http://data.semanticweb.org/conference/iswc/2013,"Poster/Demo Paper",,EOL
"Miriam Fernandez, Harith Alani, Stuart Brown","OU Social: Reaching Students in Social Media",,2013,,,http://data.semanticweb.org/conference/iswc/2013/poster-demo-proceedings,,,,"This work describes OU Social, an application that collects and analyses data from public Facebook groups set up by students to discuss particular Open University courses. This application exploits semantic technologies to monitor the behaviour of users over time as well as the topics that emerge from Facebook group discussions. The paper describes the architecture of OU Social and provides a brief overview of the analysis results obtained from 44 different Facebook groups examined over a 6 year period (2007-2013)",http://data.semanticweb.org/conference/iswc/2013,"Poster/Demo Paper",,EOL
"Raj Gaire, Laurent Lefort, Michael Compton, Gregory Falzon, David Lamb, Kerry Taylor","Demonstration: Semantic Web Enabled Smart Farm with GSN",,2013,,,http://data.semanticweb.org/conference/iswc/2013/poster-demo-proceedings,,,,"GSN is an open source middleware for managing data produced by sensors deployed in a sensor network. We have extended and enhanced GSN to enable (i) semantically aware preparation, exchange and processing of the data (ii) user specified event processing for alerts and (iii) associate sensor data to 'things'. Here, we demonstrate our smart farm as a use case of a semantically aware sensor network for better integration of sensor data.",http://data.semanticweb.org/conference/iswc/2013,"Poster/Demo Paper",,EOL
"Ilaria Tiddi, Mathieu D'Aquin, Enrico Motta","Explaining Clusters with Inductive Logic Programming and Linked Data",,2013,,,http://data.semanticweb.org/conference/iswc/2013/poster-demo-proceedings,,,,"Knowledge Discovery consists in discovering hidden regulari- ties in large amount of data using data mining techniques. The obtained patterns require an interpretation that is usually achieved using some background knowledge given by experts from several domains. On the other hand, the rise of Linked Data has increased the number of con- nected cross-disciplinary knowledge, in the form of RDF datasets, classes and relationships. Here we show how Linked Data can be used in an Inductive Logic Programming process, where they provide background knowledge for finding hypotheses regarding the unrevealed connections between items of a cluster. By using an example with clusters of books, we show how different Linked Data sources can be used to automatically generate rules giving an underlying explanation to such clusters.",http://data.semanticweb.org/conference/iswc/2013,"Poster/Demo Paper",,EOL
"Xingjian Zhang, Dezhao Song, Sambhawa Priya, Jeff Heflin","Exploring Linked Open Data with Tag Clouds",,2013,,,http://data.semanticweb.org/conference/iswc/2013/poster-demo-proceedings,,,,"In this paper we present the contextual tag cloud system: a novel application that helps users explore a large scale RDF dataset. Unlike folksonomy tags used in most traditional tag clouds, the tags in our system are ontological terms (classes and properties), and a user can construct a context with a set of tags that defines a subset of instances. Then in the contextual tag cloud, the font size of each tag depends on the number of instances that are associated with that tag and all tags in the context. Each contextual tag cloud serves as a summary of the distribution of relevant data, and by changing the context, the user can quickly gain an understanding of patterns in the data. Furthermore, the user can choose to include RDFS taxonomic and/or domain/range entailment in the calculations of tag sizes, thereby understanding the impact of semantics on the data. The system runs on the BTC2012 dataset with more than 1.4 billion triples from which we extract over 380,000 tags. Several scalability challenges must be overcome in order to achieve a responsive interface.",http://data.semanticweb.org/conference/iswc/2013,"Poster/Demo Paper",,EOL
"Craig Knoblock, Pedro Szekely, Shubham Gupta, Animesh Manglik, Ruben Verborgh, Fengyu Yang","Publishing Data from the Smithsonian American Art Museum as Linked Open Data",,2013,,,http://data.semanticweb.org/conference/iswc/2013/poster-demo-proceedings,,,,"Museums around the world have built databases with meta-data about millions of objects, their history, the people who created them, and the entities they represent. This data is stored in proprietary databases and is not readily available for use. Recently, museums embraced the Semantic Web as a means to make this data available to the world, but the experience so far shows that publishing museum data to the linked data cloud is difficult: the databases are large and complex, the information is richly structured and varies from museum to museum, and it is difficult to link the data to other datasets. We have been collaborating with the Smithsonian American Art Museum to create a set of tools that allow museums and other cultural heritage institutions to publish their data as Linked Open Data. In this demonstration we will show the end-to-end process of starting with the original source data, modeling the data with respect to a ontology of cultural heritage data, linking the data to DBpedia, and then publishing the information as Linked Open Data. Video: http://youtu.be/1Vaytr09H1w",http://data.semanticweb.org/conference/iswc/2013,"Poster/Demo Paper",,EOL
"Alejandro Flores, Guillermo Palma, Maria-Esther Vidal, Domingo De Abreu, Valeria Pestana, Jose Pinero, Jonathan Queipo, Jose Sanchez","GRAPHIUM: Visualizing Performance of Graph and RDF Engines on Linked Data",,2013,,,http://data.semanticweb.org/conference/iswc/2013/poster-demo-proceedings,,,,"We present GRAPHIUM a tool to visualize trends and patterns in the performance of existing graph and RDF engines. We will demonstrate GRAPHIUM and attendees will be able to observe and analyze the performance exhibited by Neo4j, DEX, HypergraphDB and RDF-3x when core graph-based and mining tasks are run against a variety of benchmark of graphs of diverse characteristics.",http://data.semanticweb.org/conference/iswc/2013,"Poster/Demo Paper",,EOL
"Simon Castillo, Guillermo Palma, Maria-Esther Vidal","SILURIAN: a Sparql vIsuaLizer for UndeRstanding querIes And federatioNs",,2013,,,http://data.semanticweb.org/conference/iswc/2013/poster-demo-proceedings,,,,"SPARQL federated queries can be affected by both characteristics of the query and datasets in the federation. We present SILURIAN a Sparql vIsuaLizer for UndeRstanding querIes And federatioNs. SILURIAN visualizes SPARQL queries and, thus, it allows the analysis and understanding of a query complexity with respect to relevant endpoints and shapes of the possible plans.",http://data.semanticweb.org/conference/iswc/2013,"Poster/Demo Paper",,EOL
"Mathieu D'Aquin, Keerthi Thomas","Modeling and Reasoning Upon Facebook Privacy Settings",,2013,,,http://data.semanticweb.org/conference/iswc/2013/poster-demo-proceedings,,,,"Understanding the way information is propagated and made visible on Facebook is a difficult task. The privacy settings and the rules that apply to individual items are reasonably straightforward. However, for the user to track all of the information that needs to be integrated and the inferences that can be made on their posts is complex, to the extent that it is almost impossible for any individual to achieve. In this demonstration, we investigate the use of knowledge modeling and reasoning techniques (including basic ontological representation, rules and epistemic logics) to make these inferences explicit to the user.",http://data.semanticweb.org/conference/iswc/2013,"Poster/Demo Paper",,EOL
"Rafael S. Gonçalves, Bijan Parsia, Uli Sattler","Comparing ontologies with ecco",,2013,,,http://data.semanticweb.org/conference/iswc/2013/poster-demo-proceedings,,,,"The detection and presentation of changes between OWL ontologies (in the form of a diff) is an important service for ontology engineering, being an active research topic. We present here a diff tool that incorporates structural and semantic techniques in order to, firstly, distinguish effectual and ineffectual changes between ontologies and, secondly, align and categorise those changes according to their impact. Such a categorisation of changes is shown to facilitate the navigation through, and analysis of change sets. The tool is made available as a web-based application, as well as a standalone command-line tool. Both of these output an XML change set file and a transformation into HTML, which allows users to browse through and focus on those changes of utmost interest using any web-browser.",http://data.semanticweb.org/conference/iswc/2013,"Poster/Demo Paper",,EOL
