author,title,pages,year,link_open_access,link_publisher,proceedings_uri,paper_uri,source_uri,keywords,abstract,uri_me,category,source,EOL
"Amrapali Zaveri, Joao Ricardo Nickenig Vissoci, Cinzia Daraio, Ricardo Pietrobon","Using Linked Data to evaluate the impact of Research and Development in Europe: a Structural Equation Model",241-256,2013,https://github.com/lidingpku/iswc-archive/raw/master/paper/iswc-2013/82190241-using-linked-data-to-evaluate-the-impact-of-research-and-development-in-europe-a-structural-equation-model.pdf,http://www.springer.com/computer/ai/book/978-3-642-41337-7,http://data.semanticweb.org/conference/iswc/2013/proceedings-2,,,,"Europe has a high impact on the global biomedical literature, having contributed with a growing number of research articles and a signiﬁcant citation impact. However, the impact of research and development generated by European countries on economic, educational and healthcare performance is poorly understood. The recent Linking Open Data (LOD) project has made a lot of data sources publicly available and in human-readable formats. In this paper, we demonstrate the utility of LOD in assessing the impact of Research and Development (R&D) on the economic, education and healthcare performance in Europe. We extract relevant variables from two LOD datasets, namely World Bank and Eurostat. We analyze the data for 20 out of the 27 European countries over a span of 10 years (1999 to 2009). We use a Structural Equation Modeling (SEM) approach to quantify the impact of R&D on the different measures. We perform different exploratory and conﬁrmatory factorial analysis evaluations which gives rise to four latent variables that are included in the model: (i) Research and Development (R&D), (ii) Economic Performance (EcoP), (iii) Educational Performance (EduP), (iv) Healthcare performance (HcareP) of the European countries. Our results indicate the importance of R&D to the overall development of the European educational and healthcare performance (directly) and economic performance (indirectly). The results also shows the practical applicability of LOD to estimate this impact.",http://data.semanticweb.org/conference/iswc/2013,"Semantic Web In Use Track Paper",http://www.iswc2013.semanticweb.org/content/accepted-papers,EOL
"Maribel Acosta, Amrapali Zaveri, Elena Simperl, Dimitris Kontokostas, Sören Auer, Jens Lehmann","Crowdsourcing Linked Data Quality Assessment",257-272,2013,https://github.com/lidingpku/iswc-archive/raw/master/paper/iswc-2013/82190257-crowdsourcing-linked-data-quality-assessment.pdf,http://www.springer.com/computer/ai/book/978-3-642-41337-7,http://data.semanticweb.org/conference/iswc/2013/proceedings-2,,,,"In this paper we look into the use of crowdsourcing as a means to handle Linked Data quality problems that are challenging to be solved automatically. We analyzed the most common errors encountered in Linked Data sources and classiﬁed them according to the extent to which they are likely to be amenable to a speciﬁc form of crowdsourcing. Based on this analysis, we implemented a quality assessment methodology for Linked Data that leverages the wisdom of the crowds in different ways: (i) a contest targeting an expert crowd of researchers and Linked Data enthusiasts; complemented by (ii) paid microtasks published on Amazon Mechanical Turk. We empirically evaluated how this methodology could efﬁciently spot quality issues in DBpedia. We also investigated how the contributions of the two types of crowds could be optimally integrated into Linked Data curation processes. The results show that the two styles of crowdsourcing are complementary and that crowdsourcing-enabled quality assessment is a promising and affordable way to enhance the quality of Linked Data.",http://data.semanticweb.org/conference/iswc/2013,"Evaluation Track Paper",http://www.iswc2013.semanticweb.org/content/accepted-papers,EOL
"Carlos Buil-Aranda, Aidan Hogan, Jürgen Umbrich, Pierre-Yves Vandenbussche","SPARQL Web-Querying Infrastructure: Ready for Action?",273-288,2013,https://github.com/lidingpku/iswc-archive/raw/master/paper/iswc-2013/82190273-sparql-web-querying-infrastructure-ready-for-action-.pdf,http://www.springer.com/computer/ai/book/978-3-642-41337-7,http://data.semanticweb.org/conference/iswc/2013/proceedings-2,,,,"Hundreds of public SPARQL endpoints have been deployed on the Web, forming a novel decentralised infrastructure for querying billions of structured facts from a variety of sources on a plethora of topics. But is this infrastructure mature enough to support applications? For 427 public SPARQL endpoints registered on the DataHub, we conduct various experiments to test their maturity. Regarding discoverability, we nd that only one-third of endpoints make descriptive meta-data available, making it dicult to locate or learn about their content and capabilities. Regarding interoperability, we nd patchy support for established SPARQL features like ORDER BY as well as (understandably) for new SPARQL 1.1 features. Regarding eciency, we show that the performance of endpoints for generic queries can vary by up to 34 orders of magnitude. Regarding availability, based on a 27-month long monitoring experiment, we show that only 32.2% of public endpoints can be expected to have (monthly) two-nines uptimes of 99100%.",http://data.semanticweb.org/conference/iswc/2013,"Evaluation Track Paper",http://www.iswc2013.semanticweb.org/content/accepted-papers,EOL
"Michelle Cheatham, Pascal Hitzler","String Similarity Metrics for Ontology Alignment",289-304,2013,https://github.com/lidingpku/iswc-archive/raw/master/paper/iswc-2013/82190289-string-similarity-metrics-for-ontology-alignment.pdf,http://www.springer.com/computer/ai/book/978-3-642-41337-7,http://data.semanticweb.org/conference/iswc/2013/proceedings-2,,,,"Ontology alignment is an important part of enabling the semantic web to reach its full potential. The vast ma jority of ontology alignment systems use one or more string similarity metrics, but often the choice of which metrics to use is not given much attention. In this work we evaluate a wide range of such metrics, along with string pre-processing strategies such as removing stop words and considering synonyms, on diﬀerent types of ontologies. We also present a set of guidelines on when to use which metric. We furthermore show that if optimal string similarity metrics are chosen, those alone can produce alignments that are competitive with the state of the art in ontology alignment systems. Finally, we examine the improvements possible to an existing ontology alignment system using an automated string metric selection strategy based upon the characteristics of the ontologies to be aligned.",http://data.semanticweb.org/conference/iswc/2013,"Evaluation Track Paper",http://www.iswc2013.semanticweb.org/content/accepted-papers,EOL
"Philippe Cudré-Mauroux, Iliya Enchev, Sever Fundatureanu, Paul Groth, Albert Haque, Andreas Harth, Felix Leif Keppmann, Daniel Miranker, Juan Sequeda, Marcin Wylot","NoSQL Databases for RDF: An Empirical Evaluation",305-320,2013,https://github.com/lidingpku/iswc-archive/raw/master/paper/iswc-2013/82190305-nosql-databases-for-rdf-an-empirical-evaluation.pdf,http://www.springer.com/computer/ai/book/978-3-642-41337-7,http://data.semanticweb.org/conference/iswc/2013/proceedings-2,,,,"Processing large volumes of RDF data requires sophisticated tools. In recent years, much eﬀort was spent on optimizing native RDF stores and on repurposing relational query engines for large-scale RDF processing. Concurrently, a number of new data management systems— regrouped under the NoSQL (for “not only SQL”) umbrella—rapidly rose to prominence and represent today a popular alternative to classical databases. Though NoSQL systems are increasingly used to manage RDF data, it is still diﬃcult to grasp their key advantages and drawbacks in this context. This work is, to the best of our knowledge, the ﬁrst systematic attempt at characterizing and comparing NoSQL stores for RDF processing. In the following, we describe four diﬀerent NoSQL stores and compare their key characteristics when running standard RDF benchmarks on a popular cloud infrastructure using both single-machine and distributed deployments.",http://data.semanticweb.org/conference/iswc/2013,"Evaluation Track Paper",http://www.iswc2013.semanticweb.org/content/accepted-papers,EOL
"Daniele Dell'Aglio, Jean-Paul Calbimonte, Marco Balduini, Oscar Corcho, Emanuele Della Valle","On Correctness in RDF stream processor benchmarking",321-336,2013,https://github.com/lidingpku/iswc-archive/raw/master/paper/iswc-2013/82190321-on-correctness-in-rdf-stream-processor-benchmarking.pdf,http://www.springer.com/computer/ai/book/978-3-642-41337-7,http://data.semanticweb.org/conference/iswc/2013/proceedings-2,,,,"Two complementary benchmarks have been proposed so far for the evaluation and continuous improvement of RDF stream processors: SRBench and LSBench. They put a special focus on diﬀerent features of the evaluated systems, including coverage of the streaming extensions of SPARQL supported by each processor, query processing throughput, and an early analysis of query evaluation correctness, based on comparing the results obtained by diﬀerent processors for a set of queries. However, none of them has analysed the operational semantics of these processors in order to assess the correctness of query evaluation results. In this paper, we propose a characterization of the operational semantics of RDF stream processors, adapting well-known models used in the stream processing engine community: CQL and SECRET. Through this formalization, we address correctness in RDF stream processor benchmarks, allowing to determine the multiple answers that systems should provide. Finally, we present CSRBench, an extension of SRBench to address query result correctness veriﬁcation using an automatic method.",http://data.semanticweb.org/conference/iswc/2013,"Evaluation Track Paper",http://www.iswc2013.semanticweb.org/content/accepted-papers,EOL
"George Garbis, Kostis Kyzirakos, Manolis Koubarakis","Geographica: A Benchmark for Geospatial RDF Stores",337-352,2013,https://github.com/lidingpku/iswc-archive/raw/master/paper/iswc-2013/82190337-geographica-a-benchmark-for-geospatial-rdf-stores.pdf,http://www.springer.com/computer/ai/book/978-3-642-41337-7,http://data.semanticweb.org/conference/iswc/2013/proceedings-2,,,"benchmarking, geospatial, RDF store, Linked Open Data, GeoSPARQL, stSPARQL","Geospatial extensions of SPARQL like GeoSPARQL and stSPARQL have recently been deﬁned and corresponding geospatial RDF stores have been implemented. However, there is no widely used benchmark for evaluating geospatial RDF stores which takes into account recent advances to the state of the art in this area. In this paper, we develop a benchmark, called Geographica, which uses both real-world and synthetic data to test the oﬀered functionality and the performance of some prominent geospatial RDF stores.",http://data.semanticweb.org/conference/iswc/2013,"Evaluation Track Paper",http://www.iswc2013.semanticweb.org/content/accepted-papers,EOL
"Kjetil Kjernsmo, John S. Tyssedal","Introducing Statistical Design of Experiments to SPARQL Endpoint Evaluation",353-368,2013,https://github.com/lidingpku/iswc-archive/raw/master/paper/iswc-2013/82190353-introducing-statistical-design-of-experiments-to-sparql-endpoint-evaluation.pdf,http://www.springer.com/computer/ai/book/978-3-642-41337-7,http://data.semanticweb.org/conference/iswc/2013/proceedings-2,,,,"This paper argues that the common practice of benchmarking is inadequate as a scientiﬁc evaluation methodology. It further attempts to introduce the empirical tradition of the physical sciences by using techniques from Statistical Design of Experiments applied to the example of SPARQL endpoint performance evaluation. It does so by studying full as well as fractional factorial experiments designed to evaluate an assertion that some change introduced in a system has improved performance. This paper does not present a ﬁnished experimental design, rather its main focus is didactical, to shift the focus of the community away from benchmarking towards higher scientiﬁc rigor.",http://data.semanticweb.org/conference/iswc/2013,"Evaluation Track Paper",http://www.iswc2013.semanticweb.org/content/accepted-papers,EOL
"Jose Mora, Oscar Corcho","Towards a systematic benchmarking of ontology-based query rewriting systems",369-384,2013,https://github.com/lidingpku/iswc-archive/raw/master/paper/iswc-2013/82190369-towards-a-systematic-benchmarking-of-ontology-based-query-rewriting-systems.pdf,http://www.springer.com/computer/ai/book/978-3-642-41337-7,http://data.semanticweb.org/conference/iswc/2013/proceedings-2,,,"Benchmark, OBDA, Query Rewriting, Inference","Query rewriting is one of the fundamental steps in ontologybased data access (OBDA) approaches. It takes as inputs an ontology and a query written according to that ontology, and produces as an output a set of queries that should be evaluated to account for the inferences that should be considered for that query and ontology. Diﬀerent query rewriting systems give support to diﬀerent ontology languages with varying expressiveness, and the rewritten queries obtained as an output do also vary in expressiveness. This heterogeneity has traditionally made it diﬃcult to compare diﬀerent approaches, and the area lacks in general commonly agreed benchmarks that could be used not only for such comparisons but also for improving OBDA support. In this paper we compile data, dimensions and measurements that have been used to evaluate some of the most recent systems, we analyse and characterise these assets, and provide a uniﬁed set of them that could be used as a starting point towards a more systematic benchmarking process for such systems. Finally, we apply this initial benchmark with some of the most relevant OBDA approaches in the state of the art.",http://data.semanticweb.org/conference/iswc/2013,"Evaluation Track Paper",http://www.iswc2013.semanticweb.org/content/accepted-papers,EOL
"Dominique Ritze, Heiko Paulheim, Kai Eckert","Evaluation measures for ontology matchers in supervised matching scenarios",385-400,2013,https://github.com/lidingpku/iswc-archive/raw/master/paper/iswc-2013/82190385-evaluation-measures-for-ontology-matchers-in-supervised-matching-scenarios.pdf,http://www.springer.com/computer/ai/book/978-3-642-41337-7,http://data.semanticweb.org/conference/iswc/2013/proceedings-2,,,"Supervised Ontology Matching, Evaluation, Recall, Precision, F-Measure, Precision@N-Curves, ROC-Curves, Precision-Recall-Curves","Precision and Recall, as well as their combination in terms of F-Measure, are widely used measures in computer science and generally applied to evaluate the overall performance of ontology matchers in fully automatic, unsupervised scenarios. In this paper, we investigate the case of supervised matching, where automatically created ontology alignments are veriﬁed by an expert. We motivate and describe this use case and its characteristics and discuss why traditional, F-measure based evaluation measures are not suitable for this use case. Therefore, we investigate several alternative evaluation measures and propose the use of Precision@N curves as a mean to assess different matching systems for supervised matching. We compare the ranking of several state of the art matchers using Precision@N curves to the traditional F-measure based ranking, and discuss means to combine matchers in a way that optimizes the user support in supervised ontology matching.",http://data.semanticweb.org/conference/iswc/2013,"Evaluation Track Paper",http://www.iswc2013.semanticweb.org/content/accepted-papers,EOL
"Melisachew Wudage Chekol, Jérôme Euzenat, Pierre Genevès, Nabil Layaïda","Evaluating and benchmarking SPARQL query containment solvers",401-416,2013,https://github.com/lidingpku/iswc-archive/raw/master/paper/iswc-2013/82190401-evaluating-and-benchmarking-sparql-query-containment-solvers.pdf,http://www.springer.com/computer/ai/book/978-3-642-41337-7,http://data.semanticweb.org/conference/iswc/2013/proceedings-2,,,,"Query containment is the problem of deciding if the answers to a query are included in those of another query for any queried database. This problem is very important for query optimization purposes. In the SPARQL context, it can be equally useful. This problem has recently been investigated theoretically and some query containment solvers are available. Yet, there were no benchmarks to compare theses systems and foster their improvement. In order to experimentally assess implementation strengths and limitations, we provide a rst SPARQL containment test benchmark. It has been designed with respect to both the capabilities of existing solvers and the study of typical queries. Some solvers support optional constructs and cycles, while other solvers support pro jection, union of conjunctive queries and RDF Schemas. No solver currently supports all these features or OWL entailment regimes. The study of query demographics on DBPedia logs shows that the vast ma jority of queries are acyclic and a signicant part of them uses UNION or pro jection. We thus test available solvers on their domain of applicability on three dierent benchmark suites. These experiments show that (i) tested solutions are overall functionally correct, (ii) in spite of its complexity, SPARQL query containment is practicable for acyclic queries, (iii) state-of-the-art solvers are at an early stage both in terms of capability and implementation.",http://data.semanticweb.org/conference/iswc/2013,"Evaluation Track Paper",http://www.iswc2013.semanticweb.org/content/accepted-papers,EOL
"Tom De Nies","Assessing Content Value for Digital Publishing through Relevance and Provenance-based Trust",417-424,2013,https://github.com/lidingpku/iswc-archive/raw/master/paper/iswc-2013/82190417-assessing-content-value-for-digital-publishing-through-relevance-and-provenance-based-trust.pdf,http://www.springer.com/computer/ai/book/978-3-642-41337-7,http://data.semanticweb.org/conference/iswc/2013/proceedings-2,,,,"Due to the abundance of content on the Web, content authors and publishers have a pressing need for systems that select content that is valuable for them, is trustworthy and is related to their own work. Additionally, the value of their own work needs to be assessed before it is published, to guarantee high value for the consumer. In this doctoral research, we investigate how to use Semantic Web technologies to automatically assess the value of content that is – or is about to be – digitally published. To achieve this, we propose methods to assess the relevance of content to existing publications, retrieve or reconstruct its provenance, and derive a trust assessment from this provenance. We discuss our evaluation methods, and present some preliminary results.",http://data.semanticweb.org/conference/iswc/2013,"Doctoral Consortium Paper",,EOL
"Richard Hosking, Mark Gahegan","The effects of Licensing on Open Data: Computing a measure of health for our Scholarly Record",425-432,2013,https://github.com/lidingpku/iswc-archive/raw/master/paper/iswc-2013/82190425-the-effects-of-licensing-on-open-data-computing-a-measure-of-health-for-our-scholarly-record.pdf,http://www.springer.com/computer/ai/book/978-3-642-41337-7,http://data.semanticweb.org/conference/iswc/2013/proceedings-2,,,,"As data collections become established in key disciplines, some of the longstanding barriers to data sharing become to dissolve; yet others remain. While metadata and ontologies help overcome the problems of finding and interpreting data, the lack of clarity over licensing remains a real impediment to data reuse. Freedom from legal restriction and uncertainty is essential for the effective sharing, combining and deriving of data from these distributed collections. Reuse and recombination of data will be greatly facilitated by expanding the definition of the semantic web to include the semantics of data licensing. We aim to express licensing terms in a computable manner, within the context of research practice, enabling us to infer the resulting state of rights, obligations and conditions that are inherited by derived and recombined datasets, using a mixed bag of licenses. Building off this we aim to simulate the effects of varying licensing practices within communities, proposing a measure of health of our scholarly record based on compatibility and restrictiveness of the licenses contained therein.",http://data.semanticweb.org/conference/iswc/2013,"Doctoral Consortium Paper",,EOL
"Milan Markovic","Utilising Provenance to Enhance Social Computation",433-440,2013,https://github.com/lidingpku/iswc-archive/raw/master/paper/iswc-2013/82190433-utilising-provenance-to-enhance-social-computation.pdf,http://www.springer.com/computer/ai/book/978-3-642-41337-7,http://data.semanticweb.org/conference/iswc/2013/proceedings-2,,,,"Many online platforms employ networks of human workers to perform computational tasks that can be diﬃcult for a machine (e.g. reporting travel disruption). Such systems have to make a range of decisions, for example, selection of suitable workers for a task. In this paper we present an approach that utilises Semantic Web technologies and provenance to support such decision-making processes.",http://data.semanticweb.org/conference/iswc/2013,"Doctoral Consortium Paper",,EOL
"Jonathan Mortensen","Crowdsourcing Ontology Verification",441-448,2013,https://github.com/lidingpku/iswc-archive/raw/master/paper/iswc-2013/82190441-crowdsourcing-ontology-verification.pdf,http://www.springer.com/computer/ai/book/978-3-642-41337-7,http://data.semanticweb.org/conference/iswc/2013/proceedings-2,,,,"As the scale and complexity of ontologies increases, so too do errors and engineering challenges. It is frequently unclear, however, to what degree extralogical ontology errors negatively affect the application that the ontology underpins. For example, “Shoe SubClassOf Foot” may be correct logically, but not in a human interpretation. Indeed, such errors, not caught by reasoning, are likely to be domain-speciﬁc, and thus identifying salient ontology errors requires consideration of the domain. There are both automated and manual methods that provide ontology quality assurance. Nevertheless, these methods do not readily scale as ontology size increases, and do not necessarily identify the most salient extralogical errors. Recently, crowdsourcing has enabled solutions to complex problems that computers alone cannot solve. For instance, human workers can quickly and more accurately identify objects in images at scale. Crowdsourcing presents an opportunity to develop methods for ontology quality assurance that overcome the current limitations of scalability and applicability. In this work, I aim (1) to determine the effect of extralogical ontology errors in an example domain, (2) to develop a scalable framework for crowdsourcing ontology veriﬁcation that overcomes current ontology Q/A method limitations, and (3) to apply this framework to ontologies in use. I will then evaluate the method itself and also its effect in the context of a speciﬁc domain. As an example domain, I will use biomedicine, which applies many large-scale ontologies. Thus, this work will enable scalable quality assurance for extralogical errors in biomedical ontologies.",http://data.semanticweb.org/conference/iswc/2013,"Doctoral Consortium Paper",,EOL
"Christoph Pinkel","Interactive Pay as you go Relational-to-Ontology Mapping",449-456,2013,https://github.com/lidingpku/iswc-archive/raw/master/paper/iswc-2013/82190449-interactive-pay-as-you-go-relational-to-ontology-mapping.pdf,http://www.springer.com/computer/ai/book/978-3-642-41337-7,http://data.semanticweb.org/conference/iswc/2013/proceedings-2,,,,"Ontology Based Data Access (OBDA) enables access to relational data with a complex structure through ontologies as conceptual domain models. To this end, mappings are required. A key aim of OBDA is to facilitate access to data with a complex structure. Ironically, though, in today’s existing OBDA systems mappings typically need to be compiled by hand, which is a complex and labor intensive task. Additionally, existing semi-automatic mapping approaches suﬀer from high human eﬀort for cleaning up results. Fully automatic approaches, on the other side, suﬀer from a lack of precision and/or recall. In setups where the correctness of query results is crucial but the initial human eﬀort must still be kept be small as possible, neither approach is acceptable. This situation calls for a guided, pay as you go feedback process for human mapping validation. We envision a comprehensive suite of methods and techniques that work well with one another in a seamless mapping process and support mapping construction in the context of OBDA. This suite will in part consist of a recombination and adaptation of various existing methods, but will also comprise newly devised algorithms and techniques.",http://data.semanticweb.org/conference/iswc/2013,"Doctoral Consortium Paper",,EOL
"Jack Sun,  Franky, Kenny Zhu, Haixun Wang","Query Suggestion by Concept Instantiation",,2013,,,http://data.semanticweb.org/conference/iswc/2013/poster-demo-proceedings,,,,"A class of search queries which contain abstract concepts are studied in this paper. These queries cannot be correctly interpreted by traditional keyword-based search engines. This paper presents a simple framework that detects and instantiates the abstract concepts by their concrete entities or meanings to produce alternate queries that yield better search results.",http://data.semanticweb.org/conference/iswc/2013,"Poster/Demo Paper",,EOL
